product_id,discounted_price,actual_price,rating,rating_count,user_id,user_name,review_title,rating_category,selling_price,discount_percentage_calculated,grouped_category
B0BMGB3CH9,"₹9,499","₹11,999",4.2,284,"AGOWF5LLDDKUJTPYF4WOO5RKT4JA,AGIJWXZQV3F5BX3NCSWDZVKK4RCQ,AFJH7QKP457YR2ZYLVCPSMM5SWHQ,AEUFJD6BX2IQCSBOKNA7MQFE7QKA,AHCBFTWURJCUA25OV4KMXCRKG64A,AFBJK7AC7CHF64YGGCYORLZKDJPA,AFS3FJBEMAQT6KHZEAOPUHRCVQ7A,AFCWNR2KVRYPLSRP4RNLWZVM6TSA","Vishnu VP,P S Agarwal,Rajesh Kumar,RAMA,Vaibhav saxena,Venu Singani,V Arumugaperumal,HariBol ❤","Get it with bundled discounts.,Heating & Touch screen,Buy for normal usage. NOT FOR CAMERA,The phone is a good device and I am happy with the purchase.,Average quality.,Exlent mobile,Valueable buy,A GOOD AND AFFORDABLE PRODUCT",3,2500.0,79.16493041086757,Phone/Mobile Accessories
B08D77XZX5,₹599,"₹2,499",3.9,"58,162","AH4OX4YZN7FYK5EGLIGSPL7V5GEA,AF3P7GAMRCSCUNVGINN76GPSEFFA,AEDMNVL5UD34C7NFQD5HN32ALFZQ,AHLYJZWIMC42O7FTHBOSUFOXBTMQ,AEOT3342QESRJ6Y53VNRADPFKTXA,AGGYPM6XG63MKRNTABSKYFJZNJLQ,AFSWPIVS5VSLL7M2YWCUFUSLJWJQ,AF6JRCF4K24OBBTF456CIYJKFYRQ","Suleman saifi,Nidhin Nair,RAHUL MEHRA,Uroosa sayed,Asish sahu,Ayush T.,yamuna y,Basavaraj","this is good product.,Too much bass for my liking😅,A good deal under Rs.800/-,Worth the price,Itam damage,Le skte hain,Nice product👍👍,Nice",2,1900.0,23.969587835134053,Other
B09XB8GFBQ,"₹8,999","₹11,999",4.0,"12,796","AFIJZPIDNQJFJUO46X7TVPBDYSCQ,AHIQL236HODJPRW5A5IGB34PXVDQ,AG3JTCWKG2UKPLHVG76QRTOFWTVQ,AFZVNM6MTDG7IXBRRNT7X5OGJXUQ,AGRWWPE6U7HMEWIKZ6GAN2FY2SBA,AEDWWKMEJES5SUY5QRGMWWMM7CWA,AFR4LD7PJRZE7EJSDW3QW5GINNLQ,AGWO67H5CHGZF5AAAUAD5QQCZODQ","Mahantesh,Gaurav Chaubey,uma vijay,Asif ikbal,Lomish Kumar,Kavya Singh,Sagar Mahata,Meherunnesha Sarkar","Good.,Best at the price,Good phone,NICE,Value for money,ठीक-ठाक hai ☺️,Overall review,Good",3,3000.0,74.99791649304109,Phone/Mobile Accessories
B07WG8PDCW,₹349,"₹1,299",4.0,"14,282","AEIYWH2ASVIR6LTJ2JBXPQLOUYNA,AEYBIV3UZ3VQECGKV6QRO7PLR2EA,AHEAYHNW5FVLH6XD7RRKIG32OUCA,AGKIV4JCOJQGPNWBBKPXVME7T7NA,AH32CT6EKUDWLGELKZDK4TEUWZRQ,AHPRFGJEPXRPFJBR6CEZR45ICAKA,AG4ELQEFRPWHH2ADRUMUJW6XP7JQ,AEVHROK7EARG7XEZSSNEJNP6DPEQ","Rakesh Roshan,Kani,Amazon Customer,Amazon Customer,Cheekoti Rameshwara murthy,MBS GOLD JEWELLERS,Durvesh Sawant,Wilson Rodrigues","Good,Good product,Charging well but build quality could be better,Quite nice,Good quality product,Ok,Good Purchase,Built quality could have been better",3,950.0,26.86682063125481,Phone/Mobile Accessories
B07GPXXNNG,₹349,₹999,4.1,"3,63,713","AF4MVO4JNFDEPWFKZO62OAJKRIWA,AHVPAXEWPATRASBKHOBI2I3VRLGQ,AE47PRQCNT3YFSESBLAJOH6MSCFA,AGUOSXCR3PDNC2K4X7O7QNRGPAWQ,AH5L6KKTP5ZQSN6GVQB4ZGXOM2DA,AEP5OZFTG32NCC34GCOBFO24W6RA,AEQXLMRCT4ZS65M3ST5YV6AOZG7Q,AHZXKAGAJPIMZJD5XJ5QUIYR3ORA","tarun kumar,mahesh radheshyam tawari,Blackspade,Manoj Kumar,Kartik Sharma,Placeholder,Arun,Yuvashree","Best value for money,HEAD PHONE POUCH NOT RECEIVED,Overall good in this pricerange,It's not working in my Phone properly Plz help me in exchange or return, I ll be thankful to you,Worth the money 🤑,Best,Nice sound,Wonderful product",3,650.0,34.93493493493494,Other
B0BDYVC5TD,₹959,"₹1,800",4.4,"67,259","AG44HJB2AMIVHAGQZ2WGWONERKCA,AHL2FABQV6XAHZN547DN662X5RWA,AHJE6QFY5XEOZJJWOIOHHIDFWWFQ,AEDMSJ2CEQZID62NXPKEQLMBG2LQ,AHF7ZBKNBLCLFHGJG5KXKPI7QVCQ,AGD2S7EXXSXHBCJHTXUAV6FLXAZA,AHZRUY7MR4SVM3HFJ2SZDGHZJ56A,AHEHKOZPPOVYL75KDU52PSBYDEFQ","Prashant,Sumesh Sundararajan,Vijay Baitha,S.k nahak,Vikram Kumar,Manish,Jm,amit nayak","Fake Product,Costly but excellent quality,Storage good but don't know how to Activate warantee??,Good for use,5 stas nahi diya kyuki capacity 477gb hi rahta hai,Speed not as advertise,Good one,It's ok",3,841.0,53.27777777777778,Other
B0BMGB2TPR,"₹9,499","₹11,999",4.2,284,"AGOWF5LLDDKUJTPYF4WOO5RKT4JA,AGIJWXZQV3F5BX3NCSWDZVKK4RCQ,AFJH7QKP457YR2ZYLVCPSMM5SWHQ,AEUFJD6BX2IQCSBOKNA7MQFE7QKA,AHCBFTWURJCUA25OV4KMXCRKG64A,AFBJK7AC7CHF64YGGCYORLZKDJPA,AFS3FJBEMAQT6KHZEAOPUHRCVQ7A,AFCWNR2KVRYPLSRP4RNLWZVM6TSA","Vishnu VP,P S Agarwal,Rajesh Kumar,RAMA,Vaibhav saxena,Venu Singani,V Arumugaperumal,HariBol ❤","Get it with bundled discounts.,Heating & Touch screen,Buy for normal usage. NOT FOR CAMERA,The phone is a good device and I am happy with the purchase.,Average quality.,Exlent mobile,Valueable buy,A GOOD AND AFFORDABLE PRODUCT",3,2500.0,79.16493041086757,Phone/Mobile Accessories
B08MC57J31,"₹1,499","₹2,499",4.3,"15,970","AHHN6OTOZ24Z3BWFJHUPDGRMSVCA,AHVUKBEDM5Z6JPKOPSFAFKCB4OPA,AH66GAHYTI3BUVCPVV4IXBI2DRGQ,AGO2YRYQBY33JCVUJS66EZ2KL3MA,AFRF3MH2AZZR7AJQFT7A73H7D6LA,AEYIR4EXCJIMOQZ4VP3SR5JLBYFA,AGUIWK76DI7WDRB4G4MI43257QFQ,AHOQN5US2WQJA2BOZTYDAS7VXVQQ","Topchi,Laiju,Taral,R.vijay kumar,Madhurima Dutta,Amazon Customer,DEVENDER,Abhishek Nigam","Best power bank on the market.,Small & Handy,Good Quality and functional and practical design,5v out put ravatam ledu 2or3v matrame vasthundi..,Good,Nice,Easy to carry,It is really good",3,1000.0,59.98399359743898,Phone/Mobile Accessories
B08HVL8QN3,"₹1,149","₹2,199",4.3,"1,78,912","AG3SQH676VN5EH4NDNGVVLML6RZQ,AFOCDYODRNB2UUBOTDLWKH76GP2A,AE2EO67O5G5BPFX5QGUUBOF22LQQ,AG2W2BFO5CKP4J66NZOAEIBQODVQ,AF7GDUMJMOA6YGT4OT7X2KWFRH4A,AF4VQ3FUD2OLAGRSLKACCEMSMJCQ,AHVGJKIR6HAOI5KIYL2BC52ROWEA,AGUJFMAHKPIMDPBVFWG3LBGVLF4Q","Mahesh Paryani,Tejas Panchal,SUBHASH,Kushagra Saxena,Masthan,Dipak Sutrdhar,Nitin,pushkraj_4_ever","Ok product to buy,Better than any other power banks,👍,Nice product,Performance is OK,Very Slim & easy to carry,Decent product,GOAT",3,1050.0,52.251023192360165,Phone/Mobile Accessories
B0746JGVDS,₹349,₹999,3.9,"46,399","AGHVT7WT5L4HJE2K7U2JG2YCED2Q,AEG6NCZPUEEC3YY267IS3YMFRBWA,AGD6H2VQE4PJ7QKTSCXBXPBYS4NQ,AHNYPGI5E7UACOC4BRKLLMHZKRTQ,AF4O7QE5UR2B3SBWJHEG56MP3SCA,AGKJZO3JZK7WKO5FICXBLGIOOGRQ,AHIKIHUKNQUQQWRBFB2ZP2CMWCFA,AEKCZIJF3SIFEWEL25GZDECRFQCA","Debanshu Saha,Dhineshkumar,Amazon Customer,Amazon Customer,Raghu,Ramesh Boratkar,Varsha Diwakar,sangram singh","Good quality. Does not make sound. A bit less stronger for heavier mobiles.,Good product for those who will not change the mounting position frequently,Good product, value for money.,Useful,Have been using for almost 2 months, not sure ondurability but this looks of good build - going good,Ok,Useful product,Worthy product",2,650.0,34.93493493493494,Phone/Mobile Accessories
B08VFF6JQ8,"₹1,219","₹1,699",4.4,"8,891","AH6ATQVI2YBUXDHJEADXMVOBBT2Q,AHXO4AUAOUTAX3SLS25652BOVQGA,AGFXT5AP3OGXVESL6CATDNFL3U2Q,AGIFAPAG7ZOUZL7QOBEUSHIYQHPQ,AHLDMLQTWAHHYBUVIS2J7LU4U7BA,AH3E4JX5L3FJKASHZNBWYRLK7FWA,AH4BNIVAY3WHHW7YVDRUQZBSUX3Q,AFOETT7EEXRU3TJKS7XWPRW2WMLQ","Harsh Saxena,Rishi Kashyap,AJAY,Amazon customer,abhishek,Devi Guru Prasad,mahesh madhukar sardeshmukh,Sridhar","Fine,Difference between this and a 15W is not that big,Original product,Fast charging👍,Good for Google Pixel 6a,Best a big charger as big as galaxy z flip 3,Great but little hot the mobile,Need to buy a wire seperately",3,480.0,71.74808711006474,Phone/Mobile Accessories
B09NVPSCQT,"₹1,599","₹3,999",4.0,"30,254","AF3JE3MHGVCOATHASUTMN3VGF3UQ,AEDSNOOD2D6SJAET2BTNBHLV2SSA,AGGTMAPT4WBWP2C62I6CGW22QNCA,AGC6NVLEXXVXAOMXP46RL2622EBA,AFMZPE7XRDTD4DOUAAMZOME6HG7A,AFOTHR4JPCQC4JXBR3WV4C6T5XHQ,AHHA3DXLSJ3LS57KWW56FPPV4OKA,AEJMCBDH3VXRL4SPYOC23J4OG6OA","Ranjitha Parida,Shubham Pawar,Arul,Lokesh K V,Nandita Talukdar,Sushma Pradhan,Vaibhav S,Amazon Customer","Ranjitha,Good one,Best One!!!,Good and average usage,IT'S BEEN GOOD,Good,Noise,Overall good product",3,2400.0,39.98499624906226,Wearables
B09YV4RG4D,"₹1,499","₹7,999",4.2,"22,636","AH2OARRWRYKQNYKCWGQKO3NOINQQ,AFIIBGWYNYPKBPVV3YRZPI3PYGBA,AF6HCCU2LSBC7VI7PXDP7BV234VA,AFOFD4PXG6Q4MMOSO5DL3Z6SPH3A,AFJLVCFIQOLK52GX6GEPNDVDXMLQ,AEQQH4MFXL57BHAPR5HEDWJ7IYSA,AHKFAQZRUQBRNNHBMARKC5YBCLBQ,AFU4L7YEY73K63B4VWGPBWQVAYWQ","Rahul Singh Rauthan,Sanjoy C,Prashanthi,Aditya Singh,Satyajit Patale,Owais,Amazon Customer,Himon Roy","Premium looking watch,Excellent Product,The Tracking and touch would be better,Bluetooth connectivity,Very good,The watch is good,Felt Good,Not bad",3,6500.0,18.73984248031004,Wearables
B09TWHTBKQ,"₹18,499","₹25,999",4.1,"22,318","AHJJY3GFDJFTDTX5536IMIXVNCNQ,AEYIVONPYGGVCE7K4Y3PNQPKVHSQ","Atulya Sinha,SujayZ™️☑️","THE PERFECT PHONE – FOR MY REQUIREMENTS,Galaxy M33 5G a mixed bag of Affordability",3,7500.0,71.15273664371706,Phone/Mobile Accessories
B08L5HMJVW,₹369,₹700,4.4,"67,259","AG44HJB2AMIVHAGQZ2WGWONERKCA,AHL2FABQV6XAHZN547DN662X5RWA,AHJE6QFY5XEOZJJWOIOHHIDFWWFQ,AEDMSJ2CEQZID62NXPKEQLMBG2LQ,AHF7ZBKNBLCLFHGJG5KXKPI7QVCQ,AGD2S7EXXSXHBCJHTXUAV6FLXAZA,AHZRUY7MR4SVM3HFJ2SZDGHZJ56A,AHEHKOZPPOVYL75KDU52PSBYDEFQ","Prashant,Sumesh Sundararajan,Vijay Baitha,S.k nahak,Vikram Kumar,Manish,Jm,amit nayak","Fake Product,Costly but excellent quality,Storage good but don't know how to Activate warantee??,Good for use,5 stas nahi diya kyuki capacity 477gb hi rahta hai,Speed not as advertise,Good one,It's ok",3,331.0,52.714285714285715,Other
B0B4F2XCK3,"₹12,999","₹17,999",4.1,"18,998","AGAELRYPMTG5SADZPDYB343EASAA,AGFN4JODOM2NTFCJQOHDBQLVDJTQ,AG7EZVSAXIVGMNDLSA55K7URQCJA,AGGF75HIEMB67OU7J3RDALBSUKQQ,AHY5CI4SU6JBYPIZ5RLAGO6W3F4A,AE4KODNBVTDCZWZO4HZM4GTRERPA,AH6HFHSYOY2OHMODD7244DHG7FUQ,AHRW5JERWYAJCZO65PDKZSOEPR6Q","Satheesh Kadiam,Pritom Chakraborty,Vishwa,Simranpreet Singh,Saptarshi,Amazon Customer,D.RAGHUL,Dharmendra kumar","Phone, camera, heating - works for me, may not for all,Good Mobile,Good but not excellent under this budget,Worth the price at 9499,Ok type phone... but unable to make videocall within same service provider.,Phone review,Budget king,Battery backup is good",3,5000.0,72.22067892660704,Phone/Mobile Accessories
B0BF54972T,"₹1,799","₹19,999",4.2,"13,937","AEC6UDCEAUIBIFHGQDQ4KR67GC4A,AHRKSUOZXKKDERRY3VZBVMMWX37Q,AH4F4OZIOIIBXGLL6IZIJAXSTDXA,AEGBGS574C35NMBICCMQLC5ODEKQ,AGM7ETOYBL3UFKCLZW36JM6POQ6A,AHM4G7MHKTEAZ7KQ6ADSZOTL5BEA,AHHYFEVKBVQB52YMNNKAZT6C75LA,AGZ54F47MOFAEMWXXR76OUBC75SQ","venkatesh kg,Raghuram,YOGESH,Manan Parmar,Nikunj .R. kukadiya,Shivansh Sharma,KAPIL NIMKER,Suriya","Worth the money,Good smart watch,the screen does not turn on and off on double tap, for that you have to press the button.,User friendly UI,Best Allrounder Budget SmartWatch Under 2K 🔥,This smart watch is awesome,Nice watch in budget,The step count is not that accurate but the call quality and other things are good",3,18200.0,8.995449772488625,Wearables
B09YV4MW2T,"₹2,199","₹9,999",4.2,"29,471","AEJQT5NMTAM2ZRPQDNGLOL6NTKRQ,AHIKFQ5VP6QGYQK3GJICMV4U7ULA,AHWEF3345QLMPIGGOW6VUYJZEFDQ,AFLEQIFCKD7EUBQTHJ7T7XF4MWMQ,AHLORXFV6I3JRBNER3O6DIOVWM5A,AH445QA3XXIV6FPASBU6OBICSLYQ,AHT6SE3YNTHR76UT4QDQKBHEH5EQ,AFFKCAWOTYV7EXKMDMQ5NVRRUV5Q","Deepankar G.,Babu Singh Rathore,Liton Das,Biswajit Udayabhanu,Anil p.,Anoop Sharma,Rameshwar Singh Rathore,Palash Santra","Worth the price, expecting good performance on extended use,According to this price is value for money Good product,Good budget calling smart watch.,Just Go For It,It's good product in this range,Very Good watch in this price Range,Good Product as per the price charged,Good in budget",3,7800.0,21.992199219921993,Wearables
B09TWH8YHM,"₹16,999","₹24,999",4.1,"22,318","AHJJY3GFDJFTDTX5536IMIXVNCNQ,AEYIVONPYGGVCE7K4Y3PNQPKVHSQ","Atulya Sinha,SujayZ™️☑️","THE PERFECT PHONE – FOR MY REQUIREMENTS,Galaxy M33 5G a mixed bag of Affordability",3,8000.0,67.99871994879794,Phone/Mobile Accessories
B07WGMMQGP,"₹16,499","₹20,999",4.0,"21,350","AF526AFELIHNPVD5FL7SX5YLF35A,AHY3GOQ6D4GPVJOY2WG4P7MH7NGQ,AFUI6TGJ2TLDSR4PDBMD37RSFDEQ,AHRRCKGSRMDGY56SV4ZGXHBT45EQ,AHBFSHWP4NHWBAUP2AUWUTX5MZYQ,AHAF6FEINTAVNBMIRK2RCOT6KZAQ,AHJQMR2KBHVM6PAPM3OXBGYHRPRQ,AFV7ZA733ZLME4KNLZPMPCBUNPPA","Amazon Customer,Soham Dere,Amazon Customer,kumar Raja D,Gopal kumar,Chandra kant,Nijamuddin Kuraisi,Shankar","It controls Brightness automatically whenever u go in dark place or in sunlight.,Good in gaming,Touch not good,Good mobile within the price range,Great Phone,nice phone,Budget Mein sabse mast phone,Good but camera quality is not up to the expectations camera quality is not up to the expectations",3,4500.0,78.57040811467213,Phone/Mobile Accessories
B0BF563HB4,"₹1,799","₹19,999",4.2,"13,937","AEC6UDCEAUIBIFHGQDQ4KR67GC4A,AHRKSUOZXKKDERRY3VZBVMMWX37Q,AH4F4OZIOIIBXGLL6IZIJAXSTDXA,AEGBGS574C35NMBICCMQLC5ODEKQ,AGM7ETOYBL3UFKCLZW36JM6POQ6A,AHM4G7MHKTEAZ7KQ6ADSZOTL5BEA,AHHYFEVKBVQB52YMNNKAZT6C75LA,AGZ54F47MOFAEMWXXR76OUBC75SQ","venkatesh kg,Raghuram,YOGESH,Manan Parmar,Nikunj .R. kukadiya,Shivansh Sharma,KAPIL NIMKER,Suriya","Worth the money,Good smart watch,the screen does not turn on and off on double tap, for that you have to press the button.,User friendly UI,Best Allrounder Budget SmartWatch Under 2K 🔥,This smart watch is awesome,Nice watch in budget,The step count is not that accurate but the call quality and other things are good",3,18200.0,8.995449772488625,Wearables
B07JW9H4J1,₹399,"₹1,099",4.2,"24,270","AG3D6O4STAQKAY2UVGEUV46KN35Q,AHMY5CWJMMK5BJRBBSNLYT3ONILA,AHCTC6ULH4XB6YHDY6PCH2R772LQ,AGYHHIERNXKA6P5T7CZLXKVPT7IQ,AG4OGOFWXJZTQ2HKYIOCOY3KXF2Q,AENGU523SXMOS7JPDTW52PNNVWGQ,AEQJHCVTNINBS4FKTBGQRQTGTE5Q,AFC3FFC5PKFF5PMA52S3VCHOZ5FQ","Manav,Adarsh gupta,Sundeep,S.Sayeed Ahmed,jaspreet singh,Khaja moin,Anand,S.ARUMUGAM","Satisfied,Charging is really fast,Value for money,Product review,Good quality,Good product,Good Product,As of now seems good",3,700.0,36.30573248407643,Cables
B09GFPVD9Y,"₹8,499","₹10,999",4.1,"3,13,836","AF7B5AJJZP2WKRD74Z45L7YDOEHA,AGEYI2JEUE752XDEXSTEIO7LJI5A,AGNNZL2OXJSOP4LC4PWWYSTCZAAA,AF7O7XT6CTT6WPOITPUURTLR373A,AEI3CRGT2GQUOOD67T5H2NK6J32A,AFVNPALAXLPTQV7PA3A6GG6GNKHQ,AGFWKP74BJOEEMWDPDRITXUIW45A,AF36F2CYTEDAZ7XUT5FIVJV5WIFQ","Roshan Renji Cherian,SivavaraprasadPV,Kranthi,A K Bindhani,pravesh,Subrat,Max,JAWAGAR T","Best phone for below normal use,Good mobile for minimal usage , but technically highly worth,For simple use,Ok,Good quality product,Good unit,Good,Best Budget mobile",3,2500.0,77.27066096917902,Phone/Mobile Accessories
B09GFLXVH9,"₹6,499","₹8,499",4.1,"3,13,836","AF7B5AJJZP2WKRD74Z45L7YDOEHA,AGEYI2JEUE752XDEXSTEIO7LJI5A,AGNNZL2OXJSOP4LC4PWWYSTCZAAA,AF7O7XT6CTT6WPOITPUURTLR373A,AEI3CRGT2GQUOOD67T5H2NK6J32A,AFVNPALAXLPTQV7PA3A6GG6GNKHQ,AGFWKP74BJOEEMWDPDRITXUIW45A,AF36F2CYTEDAZ7XUT5FIVJV5WIFQ","Roshan Renji Cherian,SivavaraprasadPV,Kranthi,A K Bindhani,pravesh,Subrat,Max,JAWAGAR T","Best phone for below normal use,Good mobile for minimal usage , but technically highly worth,For simple use,Ok,Good quality product,Good unit,Good,Best Budget mobile",3,2000.0,76.46781974349923,Phone/Mobile Accessories
B0BF4YBLPX,"₹1,799","₹19,999",4.2,"13,937","AEC6UDCEAUIBIFHGQDQ4KR67GC4A,AHRKSUOZXKKDERRY3VZBVMMWX37Q,AH4F4OZIOIIBXGLL6IZIJAXSTDXA,AEGBGS574C35NMBICCMQLC5ODEKQ,AGM7ETOYBL3UFKCLZW36JM6POQ6A,AHM4G7MHKTEAZ7KQ6ADSZOTL5BEA,AHHYFEVKBVQB52YMNNKAZT6C75LA,AGZ54F47MOFAEMWXXR76OUBC75SQ","venkatesh kg,Raghuram,YOGESH,Manan Parmar,Nikunj .R. kukadiya,Shivansh Sharma,KAPIL NIMKER,Suriya","Worth the money,Good smart watch,the screen does not turn on and off on double tap, for that you have to press the button.,User friendly UI,Best Allrounder Budget SmartWatch Under 2K 🔥,This smart watch is awesome,Nice watch in budget,The step count is not that accurate but the call quality and other things are good",3,18200.0,8.995449772488625,Wearables
B09XB7DPW1,"₹8,999","₹11,999",4.0,"12,796","AFIJZPIDNQJFJUO46X7TVPBDYSCQ,AHIQL236HODJPRW5A5IGB34PXVDQ,AG3JTCWKG2UKPLHVG76QRTOFWTVQ,AFZVNM6MTDG7IXBRRNT7X5OGJXUQ,AGRWWPE6U7HMEWIKZ6GAN2FY2SBA,AEDWWKMEJES5SUY5QRGMWWMM7CWA,AFR4LD7PJRZE7EJSDW3QW5GINNLQ,AGWO67H5CHGZF5AAAUAD5QQCZODQ","Mahantesh,Gaurav Chaubey,uma vijay,Asif ikbal,Lomish Kumar,Kavya Singh,Sagar Mahata,Meherunnesha Sarkar","Good.,Best at the price,Good phone,NICE,Value for money,ठीक-ठाक hai ☺️,Overall review,Good",3,3000.0,74.99791649304109,Phone/Mobile Accessories
B07PFJ5W31,₹139,₹495,4.3,"14,185","AGDDIKK55GNJNHHGBYXRZNFAJVSQ,AGZUZBCBSRL4HEUJ2ESEQI6UQAKA,AGJYX7VFOCTB6NM5OIX76FSPWYGQ,AGU6KMDRGVR2PUUQ63BWULHEYKJQ,AECPFYFQVRUWC3KGNLJIOREFP5LQ,AHINIWK2KZENSZSLBZWEDOZMNEBA,AHWGL6F44GK5FTVW5XKEIHQEIULA,AEBHTXXQFWE7YM6GAR63C4QEJVLA","Anubhab,Himanshu Yogi,Amit,Chandra sekhar sahoo,ArdKn,Devesh,Yasoob Rizvi,Abeendranath K.","Very good quality.,Nice product,Not a fast charger....,nice,A Good Type C adapter,Nice product,Value for money and easy to use.,Good",3,356.0,28.08080808080808,Cables
B0B3N7LR6K,"₹3,999","₹16,999",4.3,"17,159","AHQIYGWISGS2IQAQ3OM4IZHKIV4Q,AGXCRSJZ5RYOGMFVSLNRCILGSATQ,AE4MORXG46LGABI76KRVGV5BCLMQ,AHPN4Q3AZDX3HSUYDT7MHYDIL6QQ,AGBOBQFRZDOF5XPJRLHJYOGRFKNA","Vineet,shreyas,Amazon Customer,shaurya,Kartik Yadav","Nice watch but some cons,Great device for the budget !! And amazing amazon service!!,Good watch in this price,Watch faces could have been better,Amoled Screen & Touch, Average Wrist Band.",3,13000.0,23.524913230190013,Wearables
B09ZQK9X8G,"₹2,998","₹5,999",4.1,"5,179","AEL5HU25IP7YT5WK3LXNC5M36NBA,AG6OO5TADBKM6RSXLN54U2LYYPXA,AFBICZEMDBBG2PL7T424USBD3PNQ,AH6KGRI6O5D37TRWQAKYLMWIZMKQ,AFQY3C6LSFBOO4FUHKKVD7Q6LFIQ,AFDTYPH2YS7I3XDWEY5I6RXU53MA,AEUXJSPLBCM6V4UCEVFPF53YC4GA,AECKQGFXRQ5NR6PHVGTS5TCIYKQA","Sanjay G.,Vinay Bucha,Amazon Customer,arun,Rohit,Aasim Ansari,Aniruddha Joshi,Rekhabai bhoi","Some improvement required,Not best for tracking sleep, calories burnt of heart rate.,Noise,Noise watch is good,NOISE,Noises,Bluetooth calling,Noise",3,3001.0,49.974995832638776,Wearables
B098NS6PVG,₹199,₹349,4.0,"43,993","AECPFYFQVRUWC3KGNLJIOREFP5LQ,AGYYVPDD7YG7FYNBXNGXZJT525AQ,AHONIZU3ICIEHQIGQ6R2VFRSBXOQ,AFPHD2CRPDZMWMBL7WXRSVYWS5JA,AEZ346GX3HJ4O4XNRPHCNHXQURMQ,AEPSWFPNECKO34PUC7I56ITGXR6Q,AHWVEHR5DYLVFTO2KF3IZATFQSWQ,AH4QT33M55677I7ISQOAKEQWACYQ","ArdKn,Nirbhay kumar,Sagar Viswanathan,Asp,Placeholder,BharanI,sonia,Niam","A Good Braided Cable for Your Type C Device,Good quality product from ambrane,Super cable,As,Good quality,Good product,its good,Good quality for the price but one issue with my unit",3,150.0,57.02005730659025,Cables
B07WJV6P1R,"₹15,499","₹18,999",4.1,"19,252","AHWRZWPCTG6ICA7WTNLNNZXWFI5Q,AF2AASVYVSROFD7FXA6EFDS6N2LA,AG6YHIDBTRF4SWXLDWRVMRS56AMQ,AHELRKIGSIPF5VMAGPCPAUJYKOLQ,AH7HRG7P5VGMMU4PN7CEDU74Y2AA,AGPO4HV54G5JLGEZYJJ7NC63V6BQ,AHIMX6EL6H3CLBEVJCWLIQHSAA3A,AEITUHHOUWUNZPQDSHA2ZWQGJUMQ","siddharth patnaik,Dr Sunilkumar H,Krishna,K. S. Rao,vinayp,indhu,Jogi,DRISHTI VASHISTH GUPTA","Above average phone,Worth For The Money 💰,Okie,Phone is excellent,Purchased in good budget at 12k,It can fulfill basic needs in affordable price range,Nice,About features",3,3500.0,81.57797778830465,Phone/Mobile Accessories
B096MSW6CT,₹199,₹999,3.9,"7,928","AGU3BBQ2V2DDAMOAKGFAWDDQ6QHA,AESFLDV2PT363T2AQLWQOWZ4N3OA,AHTPQRIMGUD4BYR5YIHBH3CCGEFQ,AEUVWXYP5LT7PZLLZENEO2NODPBQ,AHC7MPW55DOO6WNCOQVA2VHOD26A,AFDI6FRPFBTNBG7BAEB7JDJSMKDQ,AFQKCEEEKXCOHTDG4WUN3XPPHJQQ,AHKUUFNMBZIDLSSPA4FEHIO2EC7Q","Kunal,Himanshu,viswanath,sai niharka,saqib malik,Aashiq,Ramu Challa,Sanjay gupta","Good speed for earlier versions,Good Product,Working good,Good for the price,Good,Worth for money,Working nice,it's a really nice product",2,800.0,19.91991991991992,Cables
B0BF54LXW6,"₹1,799","₹19,999",4.2,"13,937","AEC6UDCEAUIBIFHGQDQ4KR67GC4A,AHRKSUOZXKKDERRY3VZBVMMWX37Q,AH4F4OZIOIIBXGLL6IZIJAXSTDXA,AEGBGS574C35NMBICCMQLC5ODEKQ,AGM7ETOYBL3UFKCLZW36JM6POQ6A,AHM4G7MHKTEAZ7KQ6ADSZOTL5BEA,AHHYFEVKBVQB52YMNNKAZT6C75LA,AGZ54F47MOFAEMWXXR76OUBC75SQ","venkatesh kg,Raghuram,YOGESH,Manan Parmar,Nikunj .R. kukadiya,Shivansh Sharma,KAPIL NIMKER,Suriya","Worth the money,Good smart watch,the screen does not turn on and off on double tap, for that you have to press the button.,User friendly UI,Best Allrounder Budget SmartWatch Under 2K 🔥,This smart watch is awesome,Nice watch in budget,The step count is not that accurate but the call quality and other things are good",3,18200.0,8.995449772488625,Wearables
B09XB7SRQ5,"₹8,999","₹11,999",4.0,"12,796","AFIJZPIDNQJFJUO46X7TVPBDYSCQ,AHIQL236HODJPRW5A5IGB34PXVDQ,AG3JTCWKG2UKPLHVG76QRTOFWTVQ,AFZVNM6MTDG7IXBRRNT7X5OGJXUQ,AGRWWPE6U7HMEWIKZ6GAN2FY2SBA,AEDWWKMEJES5SUY5QRGMWWMM7CWA,AFR4LD7PJRZE7EJSDW3QW5GINNLQ,AGWO67H5CHGZF5AAAUAD5QQCZODQ","Mahantesh,Gaurav Chaubey,uma vijay,Asif ikbal,Lomish Kumar,Kavya Singh,Sagar Mahata,Meherunnesha Sarkar","Good.,Best at the price,Good phone,NICE,Value for money,ठीक-ठाक hai ☺️,Overall review,Good",3,3000.0,74.99791649304109,Phone/Mobile Accessories
B09FFK1PQG,₹873,"₹1,699",4.4,"1,680","AHPBU5B6HIJJUIPIX6GIPYKPNZ3A,AGTIGA6CWGOALBOCA5TMGUUDSPPQ,AFOYNH6UHFBRCWDLEY5GKAX2BGKQ,AEYCQ3TR2DE6XHPGHBNF5EW6KUDQ,AG7HMNN4W6OF7QVRDK3MKTR6DY7Q,AFWUBPDUKGCKVGAIFGZ6WMR6EJ6A,AHCAUACHVKPTT5MN5NGYZW4HLH4Q,AHIQOWYOEAPXFI3GJMNRV4Q7BJUQ","Amit Kumar singh,rajendra,Paramhans Jiddanand,Vijay Shanker,Vicky,Aslam T.,sandeep singh,BRAVO!!","Not that faster.....,Good quality product,Nice product.,Beauty and the beast,♥️👌Super fast charging, 1 hour main full charge, dono mobile hi fast charge hote hai.,Nice product,Super fast charger,Very Good!!",3,826.0,51.38316656856975,Phone/Mobile Accessories
B09RMQYHLH,"₹12,999","₹15,999",4.2,"13,246","AE4755NP2P2WIA3W6UZ4GBQUMYJQ,AHKCM7P5EDDMQZBKYYE75CPAF7FA,AFDRB56L4VXGIQHGTVK7NJM3WSYA,AHNAZDZEKS6VNCJWHR4ESXYPU4VA,AGWXSRHKVWHYZILFA5BDCT5XBCGA,AGXQDXGZIHZGK6VZJAMINA4COD5Q,AFEMVPAQZ54XJP3XZOPH5T4AYQ3Q,AHVAPI2PL242EH4HOBT3XMTEYFTQ","ANURAG,RAVINDER RACHERLA,Tamojit maji,Barhoo prasad chaurasia,Srinu😎,ARYAN RAWAT,ArchieFreud,Amazon Customer","Cons that most youtubers won't tell you,It's good,Battery is normal,Good celphone,Nice phone,Phone is good at the price range,Affordable,Multi featured mobile at economical price.",3,3000.0,81.24882805175324,Phone/Mobile Accessories
B08ZN4B121,₹539,"₹1,599",3.8,"14,648","AGUFJYDE6UKS5WLQYUXYVT5OTWCQ,AHOQDY4AERBRQUTZNXDGE4VONOZA,AGSNTULCKL7K3VTGVWZZ2LFC5MWQ,AE7XNRKCIQXN2W5G667XOUMKDGGA,AFA6RD2OGIVARNPAOXV7MW7LSO3A,AE7A3EKW57EKUTLWKEKWLVQV6RUQ,AFXDZ3POPMDGLR6PH7EGPUAXJIRQ,AHV2FJH22467V4ULH6KKQIWFVGLQ","Shyam,Tushar,vahida,Kapil Chaudhary,Kritish Ganguly,SARFARAAZ AHMAD,Deep,John","Do not waste your money!,stable only till half opening, battery cost is very high (2 batteries cost the same as selfie stick),light weight and useful gadget for a family to have cool pictures,The length of the selfie stick should be more.,Good,Superb,Nice product,Good product",2,1060.0,33.70856785490932,Phone/Mobile Accessories
B0B3RSDSZ3,"₹1,999","₹9,999",4.3,"27,696","AHUGCKS7YANTMDYINXQG2UDTU4JQ,AGHQ2VHXMPWZV5SV25S5N3OENXSQ,AH3GZWZM5RVOFCJCXRU7QFBAJ5NQ,AGQ2RWOECSEFEQMIGE7VTXP65OKQ,AEVUBEFT2MRH2PRVW53SJEL7H42A,AENY7L4XGCQMI627A27G3NVIBJNA,AHQISETKX3OXMZ4IX3YO7YV4UZ6Q,AGESGUTIYJQOZ7PU563DHLYSPRTQ","yogita ratre,Arun k.,Amol Basutkar,janarthanan,Naman,keshav Chelmeti,Hritik jain,Jatin Shah","7-8/10, Decent, good for day to day use,Good choice under budget of Rs2000,Average product.,Budget friendly,Overall it's a good watch,Good product,Best in design, accuracy and looks fancy. A must buy for every person who is watch enthusiast.,Having a great experience",3,8000.0,19.99199919991999,Wearables
B08VB34KJ1,"₹15,490","₹20,990",4.2,"32,916","AEW3QDKETJO6JJTGK5JI2ZW2PA3Q,AFKWBZELRCG57S5TPMOTZNE5KANQ,AEGUNYKUOOKYLZ5EVFG2RZ3IL5NQ,AF4R7KKPJVNKJC5D3CWKKX2JZAHQ,AEMRQAGETOHECPURDR3UBRHG33FA,AEI5XMVBEE4RLXD3B5VKGLNLH2JA,AEXU4Y3XLSP7AIYF33J3A7YN6O6Q,AFTK27OS7TXVU5CISEGTE75PPGEQ","Chandra.g,Shan Mohd,Suvajit Thakura,Radhe,Jyoti,Amazon Customer,kajal Kiran,Arun","Good,Amazing phone,Nice mobile ... But Amazon very low service.. every product,Value for money,Good prpduct,Good,Overal a good product,Best phone in this range",3,5500.0,73.79704621248213,Phone/Mobile Accessories
B09T39K9YL,"₹19,999","₹24,999",3.9,"25,824","AHALPOEUQFGXEZR6NQ64ZI3EIYXA,AFJEOV652OA6P6CPXI6U34PC677A,AEMQXD272M5OGFOTZDB3PBM2KSWA,AHTNHTN3WQ3NHVW27TWJLRMQDG4A,AGXGWVE46AD3MXJRAA75U5VYV4VA,AEQIOSXDNEWT7VHJIRG5AVN2L7XA,AGZV3QEQWGL37PYNL6FF2FV25Z7A,AETFDFDDPV5V47KNM2ZNBXJ3BCJQ","Indro,Bhavesh Bodat,Amazon Customer,Ambalika Sarkar,Bhosale Techno Solution Pvt Ltd,Agnish Mallick,Radhika Arumugam,Krishna","Solid phone, worth considering,Good Phone,Overall decent product,Apart from the camera everything is fine,Product is good,Honest Review after 14 days usage,Superb but need improvement in camera,Best camera",2,5000.0,79.99919996799872,Phone/Mobile Accessories
B08VF8V79P,"₹1,075","₹1,699",4.4,"7,462","AFDRGTOQGLLJ3FEYVGQHQY5XYERQ,AHRXHIS73VVO2ABYNN2KGKQJBUEQ,AHF3N2HPJZG2DWTJFC2THLYN52QQ,AGCBDQPRT37LO3J3CP5FYVIQ3OEA,AER2ODPYVD5JB5RTN7HIZZH5F27Q,AHNOI3BBY6UCQN6CNJRZF23YTFTA,AGSEYUOK3UHZTWI44ZDFKIDSWZYQ,AEOJO73NCLD6U7WZ653AZ5LO3LCQ","Akash V.,Sanket Virkar,Ashwin Sindhu,Ajithkumar M,Mano,RAJAN KUMAR,Reshma Chandwani,Sdayal","Not same as original!,Good product,Original charger,Good,Good indeed,Good item,Authentic Samsung 25W type C fast charger,Good product",3,624.0,63.27251324308417,Phone/Mobile Accessories
B08G28Z33M,₹399,₹699,4.0,"37,817","AGB2L4VZFZQISJ44XSXNEQOKSTVQ,AHQDTRQWUS5MPV5MBLSB6HTSJ52A,AH5GUOO3UWAKJD7PAMTZ6UUEYRPQ,AGKSB547ASUKUVCC4SCHFKIH7XWQ,AHWXPJ2XKKVRT2AQLZKFXMQFJLWQ,AGCVMGZJMOJNXWMAAEQPG4KMLGUA,AGRREQL2U4HCQ6K7METWAYVM355Q,AFUGCO26OHJAF7LMREGYHPS2MMOQ","Sankalpa Chakma,Prachi sharma,Manoj kumar,Sunitha,Sonu bharti,dsdewat,Asif Awaara,Arpita pal","Value-for-money,Worth to buy,Good product bass bhi achha hai,This is AWESOME,Nice earphone, India should also make like this,Good earphone comfortable feel, microphones, sound, calling.,It’s good build quality,I just love this. Amezing sound quality",3,300.0,57.08154506437768,Other
