product_id,discounted_price,actual_price,rating,rating_count,user_id,user_name,review_title,rating_category,selling_price,discount_percentage_calculated,grouped_category
B07JW9H4J1,₹399,"₹1,099",4.2,"24,269","AG3D6O4STAQKAY2UVGEUV46KN35Q,AHMY5CWJMMK5BJRBBSNLYT3ONILA,AHCTC6ULH4XB6YHDY6PCH2R772LQ,AGYHHIERNXKA6P5T7CZLXKVPT7IQ,AG4OGOFWXJZTQ2HKYIOCOY3KXF2Q,AENGU523SXMOS7JPDTW52PNNVWGQ,AEQJHCVTNINBS4FKTBGQRQTGTE5Q,AFC3FFC5PKFF5PMA52S3VCHOZ5FQ","Manav,Adarsh gupta,Sundeep,S.Sayeed Ahmed,jaspreet singh,Khaja moin,Anand,S.ARUMUGAM","Satisfied,Charging is really fast,Value for money,Product review,Good quality,Good product,Good Product,As of now seems good",3,700.0,36.30573248407643,Cables
B098NS6PVG,₹199,₹349,4.0,"43,994","AECPFYFQVRUWC3KGNLJIOREFP5LQ,AGYYVPDD7YG7FYNBXNGXZJT525AQ,AHONIZU3ICIEHQIGQ6R2VFRSBXOQ,AFPHD2CRPDZMWMBL7WXRSVYWS5JA,AEZ346GX3HJ4O4XNRPHCNHXQURMQ,AEPSWFPNECKO34PUC7I56ITGXR6Q,AHWVEHR5DYLVFTO2KF3IZATFQSWQ,AH4QT33M55677I7ISQOAKEQWACYQ","ArdKn,Nirbhay kumar,Sagar Viswanathan,Asp,Placeholder,BharanI,sonia,Niam","A Good Braided Cable for Your Type C Device,Good quality product from ambrane,Super cable,As,Good quality,Good product,its good,Good quality for the price but one issue with my unit",3,150.0,57.02005730659025,Cables
B096MSW6CT,₹199,"₹1,899",3.9,"7,928","AGU3BBQ2V2DDAMOAKGFAWDDQ6QHA,AESFLDV2PT363T2AQLWQOWZ4N3OA,AHTPQRIMGUD4BYR5YIHBH3CCGEFQ,AEUVWXYP5LT7PZLLZENEO2NODPBQ,AHC7MPW55DOO6WNCOQVA2VHOD26A,AFDI6FRPFBTNBG7BAEB7JDJSMKDQ,AFQKCEEEKXCOHTDG4WUN3XPPHJQQ,AHKUUFNMBZIDLSSPA4FEHIO2EC7Q","Kunal,Himanshu,viswanath,sai niharka,saqib malik,Aashiq,Ramu Challa,Sanjay gupta","Good speed for earlier versions,Good Product,Working good,Good for the price,Good,Worth for money,Working nice,it's a really nice product",2,1700.0,10.479199578725645,Cables
B08HDJ86NZ,₹329,₹699,4.2,"94,363","AEWAZDZZJLQUYVOVGBEUKSLXHQ5A,AG5HTSFRRE6NL3M5SGCUQBP7YSCA,AH725ST5NW2Y4JZPKUNTIJCUK2BA,AHV3TXIFCJPMS4D5JATCEUR266MQ,AGWIGDEMFIIUAOXYY2QATNBSUGHA,AFSTSLQUV4EVEXWKBOLEFHL2H5YQ,AGAKDNBHY2FKX7I4ACRGILU7QL7A,AFNWJUWJRHCC6HN52KMG5AKZY37Q","Omkar dhale,JD,HEMALATHA,Ajwadh a.,amar singh chouhan,Ravi Siddan,Himanshu Goel,Udaykumar","Good product,Good one,Nice,Really nice product,Very first time change,Good,Fine product but could be better,Very nice it's charging like jet",3,370.0,47.06723891273247,Cables
B08CF3B7N1,₹154,₹399,4.2,"16,905","AE3Q6KSUK5P75D5HFYHCRAOLODSA,AFUGIFH5ZAFXRDSZHM4QB2KPKFUQ,AFK4NJOLFSJGWLOJIUIAROJF6YVA,AFUOTYRFUXVPEBGIXVZZ7DR3CZUA,AFDLRSXKDZ6U3U3KD46SQLFGZQRA,AH5VLM66SIK7J3IRG4NY7XVOQ55A,AE3MQNNHHLUHXURL5S7IAR7JTGNQ,AFSEOFZY67MYC7UAJU264Z5NFTLA","rahuls6099,Swasat Borah,Ajay Wadke,Pranali,RVK,Bhargav,Durai Vignesh,Amazon Customer","As good as original,Decent,Good one for secondary use,Best quality,GOOD,Amazing product at a mind blowing price!,Nice Quality,Good product",3,245.0,38.59649122807017,Cables
B08Y1TFSP6,₹149,"₹1,000",3.9,"24,871","AEQ2YMXSZWEOHK2EHTNLOS56YTZQ,AGRVINWECNY7323CWFXZYYIZOFTQ,AHBAT6VLOXWGYDL57KHCNCLPXAKA,AF7NDY2H6JVYTSQOZP76GCATQ34Q,AFV7ZA733ZLME4KNLZPMPCBUNPPA,AHFAAPSY2MJ5HYOU2VQDJ7AQY4NQ,AH2WGV2PEBUTICRPBEEVKF24G5LA,AEP4MK3EKOBDKTGPJTRN5RBDIODA","Jayesh,Rajesh k.,Soopy,amazon customer,Aman,Shankar,dinesh,Chitra,Ajaybabu.O.M","It's pretty good,Average quality,very good and useful usb cable,Good USB cable. My experience was very good it is long lasting,Good,Nice product and useful,-,Sturdy but does not support 33w charging",2,851.0,14.899999999999999,Cables
B08WRWPM22,₹176.63,₹499,4.1,"15,188","AG7C6DAADCTRQJG2BRS3RIKDT52Q,AFU7BOMPVJ7Q3TTA4G67RASTGYIQ,AER5ZGIXXVYG3AWZTRZT7M2BYCEA,AHE76XQSOLGOP5ZEKTIW6KUPDWBQ,AGXTMB2XHZBEWZ2UIX7ODZ4XTU6Q,AHNM2XVU745EDPNGUOAG74PTSNRA,AH5RWQ4S72IVLZD6O75OPCFIVDXQ,AG322TYKVPLPBDXE7ABEUK5QTALQ","Vivek kumar,Amazon Customer,SARTHAK,Chiranjeevi,V V GIRI KUMAR,Rajnandini,Akshay Talla,sudhanshu chaubey","Long durable.,good,Does not charge Lenovo m8 tab,Best charging cable,good,Boat,Product was good,1.5 m का केबल मेरे लिए बहुत ही लाभदायक है ।",3,322.37,35.39679358717434,Cables
B08DDRGWTJ,₹229,₹299,4.3,"30,411","AHW6E5LQ2BDYOIVLAJGDH45J5V5Q,AF74RSGCHPZITVFSZN76K6GKPICA,AHDD7ZNB47QA2JLYU53HD4ML3VNQ,AHV3ELGDSOWBYUQLXSPDCSHBQRHQ,AEJU4L3ZM2GTILSJZZSNSF6VUOIA,AFVD66VQMSHPDT3A6HBBBGKRXBZA,AELKHQXVSSG6NHXLFJLLNEFRQQUQ,AGYSMAC6V6RFJJOHG2FIRPOZ6CSQ","Pavan A H,Jayesh bagad,Shridhar,rajendran,karuppu k,Akshay wani,Abbimaniu Singh,VISHAL H BADSHE","Worth for money - suitable for Android auto,Good Product,Length,Nice,Original,Very good quay Cable support fast charging.,Original MI cable for charging upto 33 watt,I am veri happy with this product as it provide turbo charging.",3,70.0,76.58862876254182,Cables
B008IFXQFU,₹499,₹999,4.2,"1,79,691","AGV3IEFANZCKECFGUM42MRH5FNOA,AEBO7NWCNXKT4AESAN443HQH35FQ,AE7GD3VRRYQEAHDR7FXJIR23INYA,AHPAW24BI5X2GCX5M2LHI72VSJJQ,AE2VXY4CFO36MDSIMPG43XHNF4GA,AHHQEKUNVETALN7DTRHUQ2WAWEKQ,AFMIFTNTUD5PIHGONWOTRMMZ5EBA,AHOJBIZVVIIFJKRREY4B6ESVA4KA","Azhar JuMan,Anirudh Sood,Hari Krishnan PS,Akash Jindal,PRADEEP,Rajesh,Divya Kothari,abhijit","Works on linux for me. Get the model with antenna.,Does what it say but other brands available at lesser price,Easy Handle,Great product,Perfect working,Speed is perfect,Great Design, Build, Connectivity Range, Packaging and other features but no linux support since v2,Very good",3,500.0,49.94994994994995,Networking Devices
B082LZGK39,₹199,₹299,4.0,"43,994","AECPFYFQVRUWC3KGNLJIOREFP5LQ,AGYYVPDD7YG7FYNBXNGXZJT525AQ,AHONIZU3ICIEHQIGQ6R2VFRSBXOQ,AFPHD2CRPDZMWMBL7WXRSVYWS5JA,AEZ346GX3HJ4O4XNRPHCNHXQURMQ,AEPSWFPNECKO34PUC7I56ITGXR6Q,AHWVEHR5DYLVFTO2KF3IZATFQSWQ,AH4QT33M55677I7ISQOAKEQWACYQ","ArdKn,Nirbhay kumar,Sagar Viswanathan,Asp,Placeholder,BharanI,sonia,Niam","A Good Braided Cable for Your Type C Device,Good quality product from ambrane,Super cable,As,Good quality,Good product,its good,Good quality for the price but one issue with my unit",3,100.0,66.5551839464883,Cables
B08CF3D7QR,₹154,₹339,4.3,"13,391","AGYLPKPZHVYKKZHOTHCTYVEDAJ4A,AGTTU64JMX722LYCN3SOWLFPKPAQ,AFWD4ZTM7473CDWARHCDQKK73MTA,AEXCQM3FDLX3YL3UJWWUIAIUJT4A,AHUKYUWRUVRTB3IQGISXWTSPAWLQ,AFWW4UEXAJH7EAB5LTMKMSGLUN2Q,AFM5JL37WY7G6MLQUI4WAXUJME7Q,AFECO24WYFOU2KL7C3DMHTEHRU7Q","Tanya,Anu,Akshay,Vishal Sagara Shetty,Swatilekha Sarkar,Jithindas,IBRAHIM S,Sundaram J.","Good for fast charge but not for data transfer,Good cable compares to local the brand.,good but doesnt last,Good product,Good Product,Good and worth it,very good material quality charging speed is 15 watt,Not a fast charger",3,185.0,45.42772861356932,Cables
B0789LZTCJ,₹299,₹799,4.2,"94,363","AEWAZDZZJLQUYVOVGBEUKSLXHQ5A,AG5HTSFRRE6NL3M5SGCUQBP7YSCA,AH725ST5NW2Y4JZPKUNTIJCUK2BA,AHV3TXIFCJPMS4D5JATCEUR266MQ,AGWIGDEMFIIUAOXYY2QATNBSUGHA,AFSTSLQUV4EVEXWKBOLEFHL2H5YQ,AGAKDNBHY2FKX7I4ACRGILU7QL7A,AFNWJUWJRHCC6HN52KMG5AKZY37Q","Omkar dhale,JD,HEMALATHA,Ajwadh a.,amar singh chouhan,Ravi Siddan,Himanshu Goel,Udaykumar","Good product,Good one,Nice,Really nice product,Very first time change,Good,Fine product but could be better,Very nice it's charging like jet",3,500.0,37.42177722152691,Cables
B07KSMBL2H,₹219,₹700,4.4,"4,26,973","AEYJ5I6JZZPOJB6MGWRQOHRQLPSQ,AFY5TVFOMVHGBPBTIJODYDQRZM5Q,AE3O6366WGEQAANKJ76QETTUQQTQ,AEQIJCPWSBCDKUO5VROXXHWX3PPA,AGVIAQK2HQ47P7UVXHW2NBAEU7YQ,AE3D5CJ2GDUP5SQ3AAYMVAGDTX7A,AH77IQRYD54XCRMCO7XEAIAYCLPA,AEA2HQHMFG3ZGJFOLLJQ65WKIZUQ","Rishav Gossain,Shashank Mallamraju,Purnendu,gunasekaran desomayananam,Anto RK,Sukrit Basak,Manoj Kumar,Sethuram.S","It's quite good and value for money,Works well,Hdmi cable,Value for money,All good,Gets the job done,Delivery was good,This one was my need to purchase",3,481.0,31.285714285714285,Cables
B085DTN6R2,₹350,₹899,4.2,"2,262","AGUAYQHARAKR2VZTRP276KAGETKQ,AFKTST2773VUOKUHE7FCR6QCAURQ,AEGLHOQOWUUUQEDV6EWXTSHIUE7A,AEHQYGI5L4FFALBMC5XMT5KXSZCA,AHJFXFGDAXEHIG2ZLUWVMZ3LWPBA,AEP4CW3UI7AJ7XM7PAAKVCB6U3ZA,AHIWCPCQ2Z4HWEM7V4HGTLVZQM6Q,AHT4JDEYWRIQGCA2WAQJ6E2POHCQ","Priya,Mansi,Plaban,Vivek,Taufique Ahmed,Praveen kumar,Robbin,arjun sharma","Works,Nice Product,Fast Charging as original,Good for data transfer,Average. Cost effective,Good quality,Great Product,Nice",3,549.0,38.9321468298109,Cables
B09KLVMZ3B,₹159,₹399,4.1,"4,768","AF2XXVO7JUBUVAOBTJ3MNH4DGUFQ,AH6VDJLLPBXKCWXMLBKMBCQ2ESGA,AE642RIGZIT2VPQJOLNUZ34QVWJQ,AFLHNKQH5UQZU3ATISKSMRE2KEDQ,AF2L4MCRCIDOOREQJN7QPQ4QBZCA,AGKLZ4SUHAU47KJXDVHBBEWJODUA,AHESCOYXLCXB56F4JO45X4CZQCYA,AGGHDE6KFZHEDUDJBD5R27AYMEWA","Deepaak Singh,siva k.,MUNDATH BALGOPAL,BOOPATHI,Rakesh,Ana,Xolo,Rushi","Great but,Worked well for 6 six months that’s it,Compatible with Apple iPad 2nd generation and charging very well.,CABLE,The product is good but the phone gets disconnected at multiple occasions.,Not a fast charging cable,Good item. Value,Amazing product and value for money",3,240.0,39.849624060150376,Cables
B083342NKJ,₹349,₹399,4.4,"18,757","AGSGSRTEZBQY64WO2HKQTV7TWFSA,AEYD5HVYAJ23CR6PTWOOIKUOIDHA,AFRMNW6TDHDZBP2UHF2K3MEAEYUA,AHICHCW6EC3BNV2IDAEAJPBG4HZQ,AGWFKE7RNP6EVC4JFLFSL76EEVVQ,AGEOQQHGNELZNEUKJAJUA7NTPBLA,AFS3QBSOMCE2FAZFUYZ3NBFQDLMQ,AGJYG6ZWCWD74WNE6Y37XZ2VUSMA","Birendra ku Dash,Aditya Gupta,Abdulla A N,Deepak,Gowtham,Rakesh,Pawan Kumar,Prabhat Raj Pathak","Good product,using this product 8months It is done  I have not faced any problem so far, its build quality best,I really liked this one.,Very strong and support fast charging ,,Nice cable,Best data cable charging fast,Good job,Good but need some improvement",3,50.0,87.468671679198,Cables
B0B6F7LX4C,"₹13,999","₹24,999",4.2,"32,840","AHEVOQADJSSRX7DS325HSFLMP7VQ,AG7XYZRCSKX6G2OLO7DVZWIZ3PUQ,AE2THTCCQLBIUSWPF4CPXC6GGP7Q,AHUJZOV34DFEN55QQ5XOYKVKHV6Q,AELX4DI77ZHURZTDLYFU7XMP7R6Q,AE2ODWBBOBD2SITDDIEJ644OSRFQ,AFLW4WXYQ3G6HU5LBQORDDZO3FOQ,AGGRC2P6M43GDEWCAHGYAILCSKTQ","Manoj maddheshiya,Manoj Kumar Sahoo,Saumil s.,Jean-Louis M.,Mahesh,syed azhar abbas,prabakaran,Sidhu","It is the best tv if you are getting it in 10-12k,Good price but the OS lags,GARBAGE QUALITY,Good product.,Good quality,Great experience everything is fantastic 🤠,Super picture quality and sound quality,Awesome",3,11000.0,55.99823992959718,TVs
B082LSVT4B,₹249,₹399,4.0,"43,994","AECPFYFQVRUWC3KGNLJIOREFP5LQ,AGYYVPDD7YG7FYNBXNGXZJT525AQ,AHONIZU3ICIEHQIGQ6R2VFRSBXOQ,AFPHD2CRPDZMWMBL7WXRSVYWS5JA,AEZ346GX3HJ4O4XNRPHCNHXQURMQ,AEPSWFPNECKO34PUC7I56ITGXR6Q,AHWVEHR5DYLVFTO2KF3IZATFQSWQ,AH4QT33M55677I7ISQOAKEQWACYQ","ArdKn,Nirbhay kumar,Sagar Viswanathan,Asp,Placeholder,BharanI,sonia,Niam","A Good Braided Cable for Your Type C Device,Good quality product from ambrane,Super cable,As,Good quality,Good product,its good,Good quality for the price but one issue with my unit",3,150.0,62.40601503759399,Cables
B08WRBG3XW,₹199,₹499,4.1,"13,045","AFB5KJR4Q5FICAHBOPDPUTB3O7QQ,AHW3QBHDOUMXODZ4EAMHD5JMDIDQ,AGXRGH7DLS3RVFS5KWU4PGR3H3GQ,AFLIHOX2HH7S2OJAD63UAHKMY34Q,AEHBE4U3HD6G2TMSHKE7TNZYOWCA,AFHKIURZM4R62UEXTOCZLI2FPQ6A,AEW6K4E5A4RUWRFFUDINQE5WWBSQ,AG4LMDCRAAKD4U2FZ6B6N75KTHXA","Rohan Narkar,JAGWINDER SINGH,Gursewak Singh,Avii,Amit Sharma,Ritesh Agarwala,Rahul hardaha,Amazon Customer","Good for charging and Data transfer,ਮਜ਼ਬੂਤ,Good Quality but less Power Delivery,Fantastic!,Good,Not useful,Doesn't fit properly,Can't support Oppo mobile for fast charging",3,300.0,39.879759519038075,Cables
B08DPLCM6T,"₹13,490","₹21,990",4.3,"11,976","AHBNKB74LGTYUOKPAJBSKNFV45CA,AFIECTV45ADX5YPTE2VU6ORRHTGQ,AFDUJI7KG7VMZF4JGJHV4DBCA4OA,AEUWKSX5ZL7DWOOYVDOWJKBHOVXA,AHEJW5MYVFOQBEXD6BIUBB3PJBPQ,AEM2Y22BKLFYL5BK7SC56Q75ODOQ,AHWDVB4OO4S3YS5RYQZIDBNV6BUQ,AFCEDQXVCB4LUUBWXRJS6KRU62FQ","NIRMAL.N,Manoj kumar,SOMNATH DAS,Harsha,Pradhut Roy,MAHENDRA NATH DAS,Naveen Kumar,Gopi Sahu","Sound quality,Very nice,Value for money,Good,Good for its price.,Good item,Budget friendly,Good",3,8500.0,61.34606639381537,TVs
B09C6HXFC1,₹970,"₹1,799",4.5,815,"AFNYIBWKJLJQKY4BGK77ZOTVMORA,AFCTNNMP2LZLY5466YJ5AY3JE5ZA,AG3XBWOAL65DJSBHJ7LQ2K54HJKQ,AF2ZFMLJS4UBCGZO4FMJTEPP6MHA,AFBZMRHC4GXUU7KNAK4OBKORDF6Q,AHSIQL276K7X2UP72QOOOWNVRSXA,AF3D6X5NQWOBOEVVH2Y37N55AKZQ,AFWOTSQXCQJLZ653Y7ACEZADKGYQ","Prasannavijayaraghavan G.,Preet Sikka,Theeban Raj,Nishikant,Gurpreet S.,Manoj,SP,Ashutosh","Good cable for car,Good substitute for orginal,Better Value for money Product,Way better than the original,Absolutely amazing.,Namm hi kafi hai,Very good,As the names say Durable cell it a durable cable ;-)",4,829.0,53.918843802112285,Cables
B085194JFL,₹279,₹499,3.7,"10,962","AEO5FHWNOSFBT554DKQAG4ICBGFQ,AGIQ5Y7Q4MKZ542KKVFZLAIZV6GQ,AFD53TWXXCPJAYQJ7REZPW34AKKQ,AHBMHE56M3IAD7Z4KXUKREAZX3WQ,AFR4YULNFZZC5DJOWH2KNFAOM6BQ,AEP5UMK4KDMGZGBHBLZDB2R37OMA,AHLKQWAPXICPCSCIPIF6C6FOENOQ,AHTBS46SCEBGWK4SUH3FOQEORR3Q","aditya d.,Paranthaman,ashik rahman c,Rajas c.,Madan Tejaswi,Sumit,chaitanya srikrishna,subeh sharma","Good product ; Average Finishing,Save it purpose well without any issue. I am satisfied,No issues,NO NEED TO PUT AUX CABLE FOR CONNECTING AUDIO FROM SECONDARY MONITOR,Good product,Not so Bad,Good,Worked will for only 3-4 months.",2,220.0,55.91182364729459,Cables
B09F6S8BT6,"₹13,490","₹22,900",4.3,"16,299","AHEVO4Q5NM4YXMG2HDDXC5XMBGRQ,AFZPH7ZAWX5VDY3HOBNYRDGIDBVA,AFURD6VVHRG4HZ36KXGXYUTVUDLA,AHJF5BZJNDLXJXSW74ZPLHGO7GUA,AFUS52CHEA75E2YGQ6SYGP3PKBGA,AGS3YC22FW2PCSH3I7ODDXETZ6BA,AGGI2H2AGOIX6IBDJRWULYUP5DPQ,AG4TU4LCQXF2XTLMMGMFTNWL3OOA","Rahman Ali,MARIYA DASS,Md Aftab,roshan s.,Mohan,Devendu Sawant,Shek hussain,Prathap Pathaneni","Good,Sound is very low another brand comparing in better,Service provider not meet my home refuse, tv i am not using bad service,Good product,Ok super,Floor stand does not come with it ...,Good,A budget friendly TV with a clumsy UI and Remote",3,9410.0,58.90829694323144,TVs
B09NHVCHS9,₹59,₹199,4.0,"9,378","AHIKJUDTVJ4T6DV6IUGFYZ5LXMPA,AE55KTFVNXYFD5FPYWP2OUPEYNPQ,AEBWA5I4QFCA3P3OBEPMELBGN4GQ,AHMGAC6QM62UXNEOCZIHLHSXPP2Q,AFHROSCGIXUPV3FYQ7H5QOD46Q7Q,AEAMIR3CMSA32IDEINSJKHRNANTA,AF355FTXYAKFH5NYPRTE7SL3WO3Q,AG5DWPD54QGSLWJ6QUFERLPNAX4Q","$@|\|TO$|-|,Sethu madhav,Akash Thakur,Burger Planet,Justice ⚖️,indrajyoti d.,Aditya Kumar,E.C.GEORGE","Worked on iPhone 7 and didn’t work on XR,Good one,Dull Physical Looks,Just Buy it,Go for it,About the product,Get charging cable at the price,Working well.",3,140.0,29.64824120603015,Cables
B0B1YVCJ2Y,"₹11,499","₹19,990",4.3,"4,703","AFSMISGEYDYIP3Z42UTQU4AKOYZQ,AF5ILQY4KFDTO5XHHBJ42W5DXCZQ,AFBK3X6D3AHEHSYYXPL4L6JEMSLQ,AFNB6YVNGE6IT3AWQVSIG2TJ5L3Q,AGGKMIGXUM3JRNVY7HZ3JHPJ7WTQ,AFMECPERM2GI2XQJSBWEPZKODISQ,AETPKXNOTUEX5GH7WL7XQHDR5M7Q,AERFCJ6BOMVO5YW5XM5Z2ESOIK3A","Ayush,ROHIT A.,Kedar,Haran,Santosh Ghante,KRISHNENDU,Harindra,sangamesh","Wonderful TV and Awful installation service from amazon,Acer Television Review,It's a good product for that price.,Good for the price,Almost a complete package,Nice Product,Good product,Super designed",3,8491.0,57.52376188094047,TVs
B01M4GGIVU,₹199,₹699,4.2,"12,153","AGVUE2NFN2MQEOQ4PR525B2ZI5PQ,AFO4M4BQ2WS7A3LPKJY45B5C7DYQ,AG6CREU25N6P2H7RCHNIU6GGJ5BA,AHFITGJEF76CXALJZLYP6OIC4EOA,AG54MN24SX3EMMON4AMBUNL74K3Q,AF3GETWWBGMLASY2KKNNBS2VO6DQ,AHEIPXMFMVWHNPLGUXUIV5XNP2SA,AFWQRBBVJWYTYUFQHUJE63S6VXJQ","Yashpreet Singh,Abiram,Aakaash Ramchandani,Amit katoch,Avijit Basak,Anirban B.,Dass,Gopalakrishnan","Cheap product and same is the performance but does the job,Good,No Box!!!,Good,Value for money,A very good quality cable with rubust built, and it does the work.,Value money,Good product.",3,500.0,28.469241773962807,Cables
B08B42LWKN,"₹14,999","₹19,999",4.2,"34,899","AFUT7ANZTZYGLXU65EQ2D5OP6UMA,AGT7YYJVUC6ZHRKQHVUQZMDNLXEA,AE7OMK3IQJR2U2JZE2HQ4BKSPA6A,AGCRCU432TIF4J2EL7GBEWOIULGQ,AERQBL3BISJQVHO3RLOOA4HKZX5A,AHIWNZ2HBQAHVE4OWODM6WH4PMOQ,AH2347WTE3DZ3TIZUB5LCLZPAYEQ,AHIH3QL5XONYJWEXF7VKLFHZBDJA","ATHARVA BONDRE,Sujitkumar Thorat,Chandrasekara rajasekara reddy,J vasanth,Placeholder,roshan,Boopathi,Rajesh","Worthy and most affordable - Great TV,Good product,It's really worth the money but,Better product in this budget,Product review,nice tv,Best product,Budget friendly TV",3,5000.0,74.99874993749688,TVs
B094JNXNPV,₹299,₹399,4.0,"2,766","AFYR53OTBUX2RNAKUZHUJ4RFJJNQ,AHR735YWWYFTQI5VGEEYP3DZPB6Q,AEO5NTPVZBDP7EHO2NOJ3Q6QPN3A,AF7S5C6MJ7XPJ26E3U3Z5TIWHRMA,AGY65IJP7XREWO3GUDT46474CYKA,AE2E632GMYL5U2ESNXOX5UT5D34A,AFHE44JRHYO42EGIWNM2GC75ZIJA,AEMJJHRL3DAOOLBWHIDSFW56MJWQ","Anand sarma,lokeshnist,C,SAI KIRAN,Amazon Customer,Jagdeesh singh,Kalpit Sultania,gopi","Ok cable,three pin with hybrid wire,Sturdy,Nice,Good.,So good,CarPlay Not supported,पैसा वसूल 🙂",3,100.0,74.93734335839599,Cables
B09W5XR9RT,₹970,"₹1,999",4.4,184,"AHZWJCVEIEI76H2VGMUSN5D735IQ,AH2DFUHFTG4CKQFVGZSB4JHXSAWA,AGYTSAUTXMOPROERNJPXNEB2XWNQ,AF5JWNCDVWTXOFCICR6IYNOEQENQ,AEEFM3W6RGC2KDYG5B6N7VQXR4QA,AGRT55DXEGF2EOL63HOKKKBB2KFA,AF6R7AMFHIWTMNFF6WPGFDOF7Z5A,AEGXNM3XGAHJGUJ7MIFPE7QFMJHA","Amazon Customer,Govind Gujarathi,Vihari,shalem,Tejas,RADHA krishanan,Vasudeva Govindraju,Amazon Customer","Very good product.,Using as a spare cable in car,Sturdy, Durable, Fast Charging!,Good brand,It’s like original apple cable,One of the best wire ..,Super well build. Quality product worth the money,Good product",3,1029.0,48.524262131065534,Cables
B077Z65HSD,₹299,₹999,4.3,"20,850","AFA332YHUPB6I7KMME7SOFX5RKQQ,AH3LHRL5P4YAVOQQCH72G2PJFXSA,AGUUHLF34AIEIOE5KULXXVWKBCMA,AHWY6IG3PXBBJMLVFMHHKM25BVCQ,AEOKB3ECJUM6UQOBFKMEMQVVHL4A,AEYA6LQE25O2P6C7XV62XM3YV2EQ,AHMKSLALVS62JUHSHAI3FUXWDYYA,AFZIZOK5KDBOB5QCHUQRR2ZWUYKA","GHOST,Amazon Customer,A Vase,Mani Jha,Anu B,Ganesh Inguva,Prabhu,Amazon Customer","Just buy it dont even 2nd guess it,Quality is good,Nylon braided quiet sturdy,Amazing,Feels like steel harnessed wire - strong,Sturdy and durable. Useful for charging Power Banks,good,Nice quality",3,700.0,29.929929929929934,Cables
B00NH11PEY,₹199,₹750,4.5,"74,976","AGBX233C7B7D7YZEL7ZLFWMQKFDQ,AFKSU4D3IE4KNDBVVBEA3AHDD2YQ,AHJK4PVBRGDX4N5LYA4EKHULJOPQ,AFW6NV5N3FUXV3CNUACPSYC5AB3Q,AGOCMOZJWGI5VHFT2RZLTQFZLKPQ,AGX3GCRGFU4IHAJZRUP655EEGSQA,AEG5JOZOUBWEAZOGQQR6YDVPTL6A,AGUQYXAUPX5VOWYZTIWXMUIGVGCQ","Pravin Kumar,Maestrov,rag,Mukundha2good,Amazon_Shopper,Sonic,Pratap,Amazon Customer","Nice,good,Paisa vassol,Sturdy and long.,Good for the price and great quality.,Works as expected,Good,Good",4,551.0,26.53333333333333,Cables
B09CMM3VGK,₹179,₹499,4.0,"1,934","AGHYCMV7RJ5D76UEZDZJPPEUGU5Q,AGKG3U55NSBTQ4QBDCGLUGSEEICA,AEK7TJPOW2SWCHCQOA7OEGXDZPCA,AH4QNGP7K2SO6FBWTS4Y274VHV6A,AH6CX2UTCOW6LXS74QK3TCQOHRIQ,AG4T75DAKCNZ6EPYPMKBGV6J54JQ,AF4GBAADHEMI3ZLPBAIZWYWN7GJA,AGOMXFNBIQBEWLN4JDC65FDPTBDQ","Rishabh,Amazon Customer,Darpan chauhan,Kumar Ketan,Amazon Customer,jayaprathap,Nirmal,Mihul pandey","Good product,Good for charging, bad for data transfer,Wait  to get mexmum discount.,The cable quality is best and charging pin is at right position to stand 👍🏻,So far super,Good,Good but issues with design,Maine ₹99 me liya hai offer me or ye worth hai.",3,320.0,35.87174348697395,Cables
B08QSC1XY8,₹389,"₹1,099",4.3,974,"AHMKXORT3VNMB75C3EUBYMFYELFQ,AEKJRELVNMICYPOYTKMVF52YX2WQ,AHQPBXZSJ3XZILPJVXE4BN7ZL26A,AGELSEJKLWPVNPXQ7DGK63PEQF5A,AGGBXJFPXZVOJMMB6MMQOPLCJWGA,AEWA5TH6PMRZXMFY5MHCIU2MNFHA,AHPDFQLNLMNV5X4QNH6J7IUMREAQ,AGKQKPUOEC3LQR7GHBQYAHPTU4SA","Pratyush Pahuja,Thiyagarajan,yeses,Amazon Customer,Ajinkya,The Scarred Man,KULDEEP GUPTA,Abhishek Thapar","Great Cable, Charging Speeds Could Be Better,Good,A good cable.,One of the best type c cable,Works as intended.,A good buy. The extra length helps a lot.,Good,Ok",3,710.0,35.3958143767061,Cables
B008FWZGSG,₹599,₹599,4.3,355,"AEQWVGESA7TDGK7KZ4DAJQGYH32A,AECGAMNNIMW5QOPOBXRYQAKMQGEA,AEA5X2W76STDCKVMFZ2WP7H7QFUA,AEWMPOUFVOFZ3WMJGHLOYQ7VGUJQ,AGLVW6SUWTW35HT5AYQR4CKA5IOA,AFSU7KWDY4KGQSFFCRXJ4IPJREAQ,AHS7DI2FACP3P3FNVH7263NLW2TA,AELNHGVCLQTWAEFDH244JJZZSVAQ","Verified Buyer,Avishek Majumdar,Drowna roy,mahaboobali khan,Aamir,PRAHLADAN K N,Abdulkadir,raja","Good,Genuine product,Not first charge this cabil,,Nice cable but known durability,Got a used type c to c cable and the xable was damaged,The product is Genuine and Good,Abdul kadir,Good",3,0.0,100.0,Cables
B0B4HJNPV4,₹199,₹999,3.9,"1,075","AF477BP57JM7Z4JD4PYB2K33R6AQ,AGTDD34Y77OB36JNYQWQDN7MHECQ,AG7POKBSWQUO4VOYD4HDWYKMMJ4Q,AFZS6H2ZFJEJHRWIJ3IYL7V6KRPA,AHCYM2ECKI2MNOIDHDG4PT6IIN6A,AECZ4IP3TBM4EUG52BZAOQV3EKIA,AH6RQDXZYKAUPNBOYC4NAZERTFOQ,AFTVETL4HGH4KRUF4NXGJUEDPBAQ","Placeholder,श्रीPKजी,Gauri salkar,aQeel,Ashish Raj Arora,Ankit,Amazon Customer,Ramamoorthy Jaykumar","The metal pin is losing it's strength,Sahi h bs 44 rupe ki and dilivery charge 40,Good Charging cable,Good sturdy micro usb cable with good charging speeds,Cheapest micro USB cable in the market,boat is better than this,I bought this for 199rs best charging cable for all mobiles,Good",2,800.0,19.91991991991992,Cables
B08Y1SJVV5,₹99,₹666.66,3.9,"24,871","AEQ2YMXSZWEOHK2EHTNLOS56YTZQ,AGRVINWECNY7323CWFXZYYIZOFTQ,AHBAT6VLOXWGYDL57KHCNCLPXAKA,AF7NDY2H6JVYTSQOZP76GCATQ34Q,AFV7ZA733ZLME4KNLZPMPCBUNPPA,AHFAAPSY2MJ5HYOU2VQDJ7AQY4NQ,AH2WGV2PEBUTICRPBEEVKF24G5LA,AEP4MK3EKOBDKTGPJTRN5RBDIODA","Jayesh,Rajesh k.,Soopy,amazon customer,Aman,Shankar,dinesh,Chitra,Ajaybabu.O.M","It's pretty good,Average quality,very good and useful usb cable,Good USB cable. My experience was very good it is long lasting,Good,Nice product and useful,-,Sturdy but does not support 33w charging",2,567.66,14.850148501485016,Cables
B07XLCFSSN,₹899,"₹1,900",4.4,"13,552","AF2IRSQZKMBGX44YDNUPYRHWXOZQ,AF6VSSXOI3Y4PZCNRJ3L27NCXPYA,AHQKC4MLLVOPBTKJFDBGTXFRKLYQ,AGX5ELLH3KJJ4CY2DJJOXDSOEI6Q,AGJ23TWSY6YFMAVSEAOAUEWO4QLQ,AFOHB4M2RWSUQ3SSZWPMD2FPH6PQ,AFVHKKOI25DAQSETPL7Z5W5SIVUA,AE55WJERHR4C7SEAIWX4JJHFSZBA","Wraith,Krishna Engineering,Kindle Customer,Deeps,Chintada Bhaskar Rao,FH,Vasudev,Done Chandra Mouli","Good,Worth to buy,Great value for price,Good product,Nice product.,Reliable and worth it!,Much more sturdy and durable than Apple cable,Good",3,1001.0,47.31578947368421,Cables
B09RZS1NQT,₹199,₹999,4.0,576,"AHUH7OYN3LAUATF5EGA575WCDI6A,AFQRX6TAM6CHKARXIXR25X4Y2K2A,AFIAYICSN46TZ373SYU2DLQH7MHQ,AE7O44O3ZCU6YCS56X4UBNSMN2DA,AG7KTA6KY5FALZELPIEMQBXP6TYA,AFW2YA3CWHADWVPZJRCSYJJ2O3YA,AGOGMKLERURWSCD4RIH53WPEVTWA,AHXAYZML25KY3YMOTME234UUGWXQ","Anmol,Vani,Tejas Jha,Rishabh Gupta,Nik,Harsha,Thota Srinivas,Lokesh","Worth it!,Good one,Robust and effective.,Good,Good,It's a good product under 199 rupees It's neatly packed and has good quality built,Nice product,Worth the price",3,800.0,19.91991991991992,Cables
B0B3MMYHYW,"₹32,999","₹45,999",4.2,"7,298","AGDOVGWZKEQ3M6DA2GHV6WUZT5SA,AGEUXHN7U2Q26CM6TFOTW7GZXFXQ,AHYXZVXUY3QTBP7IBFIUBSZVH2XQ,AGO4OKG6KVBAAE52Q62JBKHRDFFQ,AGOARJLTS744KQC3BTKT5KQVOJUA,AF6XISKAQXTX3Q5RUF2M2VKOJ66A,AEP6PYK2DLTD5UCMURSUNUE4IE5A,AHJSNMHQQWE6LMFRATH5LLJBQQXQ","Abhishek Kumar,Arun prasath,Naveen,Harmit,Placeholder,Precision Engineering,Senthil Kumar B,Sasikumar madurai","Decent product. Value for money.,Value for money,Improvements Needed,Everything thing good except the installation experience,Overall taking all aspects TV is good within the price point,Tv installation services,One among the good TVs in the market.,Picture",3,13000.0,71.73851605469685,TVs
B09C6HWG18,₹970,"₹1,999",4.2,462,"AHRUMHBZ7IAQPLH4W5Y3A6HLQFVA,AGSJW5TCLJEKW4HAJAA4XRRNDAWQ,AFPK3KEV3ZSEJ7K6U6C3LERQ2E7A,AE43YOKQNGCH4SSBHBYFXDSPX6YA,AF6UDET5A7UZVF6X6PLTCNPAG2JA,AG4NQECOQ6XL3YXY2ARSILF65W6Q,AGQKQGF2M565PCZ2RPUYM7HIWH3Q,AF5PAF6QWH67HHLGCH6LBYQJPPUQ","Koushal K Jain,Mathew Jibin,Jeevan,Hemanth J.,Rajiv krishna,Mohammad Thayub Pasha,MANOHAR MALTHANE,pragati","Product is as expected,Cable has problem with samsung galaxy s8 ultra tablet,Quality and service is good.,It's perfect, definitely what i needed,Worth buying this cable,Just awesome 👌,fast charge, sturdy build quality, absolute value for money product, 2yrs warranty, just go for it,Good",3,1029.0,48.524262131065534,Cables
B00NH11KIK,₹209,₹695,4.5,"1,07,687","AEYHTCWWZYU3JQBU6SLNFFT3OMVQ,AENQPV63OVBZHJ7L7V37M2ADFY7Q,AH7J7BCTWAMK2REWT4AMA2V5DPUQ,AFZSC27UUKDN5VYQVMAPYZNQTULA,AHM56NVJXROPTI5WICZITI4YAZAA,AEWZZXQWEU2QSVBCT7AJQ3FXMZWA,AFBLTBDVC23HRPXW2OQ2JDV3BNNQ,AGCX23QVQFBCYCAUWQNM4YHMKMQA","Shiva,Uzef,kottala samuel,Renjith,Dhivakaran,Mark,Utkarsh Tripathi,Vijay Sreekantan","Functionality as described,Working,Great USB in budget,Good,Good,It just works,Works with my Casio ct-x700 well,Still working after 3 months",4,486.0,30.071942446043167,Cables
B09JPC82QC,"₹19,999","₹34,999",4.3,"27,151","AHB43CZ4RHLJ5S6CBOWX6MEI7J4Q,AHP24JLRZ2DTLBEX22A6DVUJDSBA,AGLKKKJCKHZ32S7MCK46JWDZ2A3A,AHXCZCBKCKFAOJJ2GOCQS3OKPQOQ,AHZ4UBDUCUMY6IGCR67LB4P5RBXA,AHCGV72I3RKXOSSUNK3SQOB677NA,AFTCOTLY72MCSV5WHMHSZ67ZZG6A,AEF55HUCR2L3DMBXVV4SGD55JKIQ","Sameer Patil,TechnoLoon,Deepti Rawat,Ajay,Sagar Rastogi,Gangadhar Rao Nepa,Jaydeep,Rishi Kapoor","DETAILED REVIEW after 3 WEEKS of Usage !!!,Priceworthy.,It's a good product,Good,Vivid picture quality is stunning,SUPER DEAL,Value for money,Very nice",3,15000.0,57.1416326180748,TVs
B07JW1Y6XV,₹399,"₹1,099",4.2,"24,269","AG3D6O4STAQKAY2UVGEUV46KN35Q,AHMY5CWJMMK5BJRBBSNLYT3ONILA,AHCTC6ULH4XB6YHDY6PCH2R772LQ,AGYHHIERNXKA6P5T7CZLXKVPT7IQ,AG4OGOFWXJZTQ2HKYIOCOY3KXF2Q,AENGU523SXMOS7JPDTW52PNNVWGQ,AEQJHCVTNINBS4FKTBGQRQTGTE5Q,AFC3FFC5PKFF5PMA52S3VCHOZ5FQ","Manav,Adarsh gupta,Sundeep,S.Sayeed Ahmed,jaspreet singh,Khaja moin,Anand,S.ARUMUGAM","Satisfied,Charging is really fast,Value for money,Product review,Good quality,Good product,Good Product,As of now seems good",3,700.0,36.30573248407643,Cables
