product_id,discounted_price,actual_price,rating,rating_count,user_id,user_name,review_title,rating_category,selling_price,discount_percentage_calculated,grouped_category
B09KLVMZ3B,₹159,₹399,4.1,"4,768","AF2XXVO7JUBUVAOBTJ3MNH4DGUFQ,AH6VDJLLPBXKCWXMLBKMBCQ2ESGA,AE642RIGZIT2VPQJOLNUZ34QVWJQ,AFLHNKQH5UQZU3ATISKSMRE2KEDQ,AF2L4MCRCIDOOREQJN7QPQ4QBZCA,AGKLZ4SUHAU47KJXDVHBBEWJODUA,AHESCOYXLCXB56F4JO45X4CZQCYA,AGGHDE6KFZHEDUDJBD5R27AYMEWA","Deepaak Singh,siva k.,MUNDATH BALGOPAL,BOOPATHI,Rakesh,Ana,Xolo,Rushi","Great but,Worked well for 6 six months that’s it,Compatible with Apple iPad 2nd generation and charging very well.,CABLE,The product is good but the phone gets disconnected at multiple occasions.,Not a fast charging cable,Good item. Value,Amazing product and value for money",3,240.0,39.849624060150376,Cables
B084PJSSQ1,"₹1,299","₹3,000",4.3,"23,022","AHOXZCFLXIOIPGI7DXYFAI2644UQ,AERATALW2RRDMFXI77X4JJBT23RA,AFCKOCN7FG2KC4PCZZUORJFFGEJA,AHWQSD5JHCOHW7JYN7F52ABQCJQA,AFAVZL5OGYPPWWRW6TJ7XTEHPVFA,AGKSU4ZSIR6TKLSZKM3IHFEH3FZQ,AFPXTEAIUHCMFSNSGOL4CREXR4PQ,AH4TEK5IQCC2BSF2KSQNKQEXAPLA","Arun,Muneeb,Jatin,Gangadhar,Rohael saifi,Amazon Customer,Amezing books jordar.v.mc,Ramamoorthy","Ya Nice..value for money..,Overall decent Product,Great deal for 1200,Good but heats up a little and error issues,Fast and efficient loved it,Does the job,Very good,superb",3,1701.0,43.3,Storage
B097R25DP7,"₹1,599","₹4,999",4.0,"67,951","AHECNVXSW6REC5TOGBH6OJXIBL4A,AFWAX2O5B5I36ESHPOWZKN25BYPA,AHSDH2Q4Q2QSUYUGEAGPIR22MT7Q,AFSJOIQSSLDDJPOWX3DDKXDA6T5A,AF7YEBOIUIR3AWM2L4PCV2MCTUOA,AGUXZXNTCLWNP7Y5QA2KYEJLBMKA,AGBT7W456GGMVOR73SNSIGLSK5DQ,AGYF2BCD5W756VOY2V5HJQCX4H4A","Ankita Dwivedi,Malathi Alunkar,Shubham♎,Oishi Basak,Vikram Sen,Dhananjay Sevalkar,Manohar salave,Kareti Naveen","Noise smartwatch,The product is good overall,Good Battery backup,Okayish product,Watch not working,Satisfied.,It's great watch,Noise",3,3400.0,31.986397279455893,Wearables
B097C564GC,₹294,"₹4,999",4.3,"4,426","AGO5SRT3ESLNL5WTRQFD5BSIYPQA,AGGNODUMRADB3PQQTLA3U7UKYEWA,AHOUPKNSFRTL4F3KLBXFMEFJSKUA,AE2BXTBQXZ54NAE4NYNFSBR2WREA,AFC3FFC5PKFF5PMA52S3VCHOZ5FQ,AFVUO24OGRVCE6Y7NXYDIOQZONCA,AFJGD6THKLQUOW46YHUM7RY2IPJQ,AEXCIDSOW3GVBORUKET6SP7RJ2PQ","Naga Sai Gadagottu,Neha Sharma,Amazon Customer,Ankita singh,S.ARUMUGAM,Umesh,Vasudeva,Krishna Chavan","Tiny helping hand,Good product,As a whole good product,It works,Used ,as of now satisfied with the product,beep sound while connected,Good product,USB to C adopter",3,4705.0,5.881176235247049,Other
B08CYNJ5KY,₹828,₹861,4.2,"4,567","AHCS34T4DOHWPNKZ2G3W76AITIKA,AGEMHG7WVU23NHOM3FGBFUDR4U2Q,AGCOAUC6ORUPLX2ZZZQR5HD3HGHA,AHO4LKHLICKCC2UKDNIAITWMGBJA,AGU4OVT7IYKSJIBKTMGCTB6DYUOA,AG6JGUFT2AOXWJS7UIOZBRYVE7VA,AFUES4NRZYASSBOKEIWJLHRO7CPA,AHDATOMH7HPV57Q6UFWUI47QEQ5Q","Hrishikesh,Mir Manzoor,Hanumathkumar,Amazon Customer,Gerry B,Yamini,Christin Sebastian,DIMPLE BATRA","On average is ok ok pricing,Good,Quality good.,Better,The original ink cartridges are always the best,Costly,Expensive but the product was good,Good",3,33.0,96.16724738675958,Other
B00Y4ORQ46,₹745,₹795,4.0,"13,797","AE4XKNCRFDT42UVC2DCKMIXW4MVQ,AFF4VJIKK6EL5VW7Z7QZGE2JAG6Q,AEV7WXLS2DB6RQA4TZIZ3A3E5L3Q,AGQUCM3GAU6HWOILIQRBR73AAR6A,AFRRHZVMJ63DSEXGYKGIGH7QJYJQ,AE5B4IQUTNKHTVKOPXPIZF7BSVCQ,AHQTD5TF5VW5IPOSAGIZ7VYFB66A,AFHJSGFTBH6DO62VXXNYJWTRC5JA","kishorekr,Anil.c,Abhishek B.,Ashutosh Bhagwat,Sandeep,Shivdev Singh Dhanjal,Avinash,Ankur Singh","Good product but low quality at less price,I took for meetings and it working well.,Good but built quality ok,Problem with comfort for long hours calling,Headphone,It does the job well.,Noise cancellation is quite good in this price range.,Work with teams! perfect budget headphones.",3,50.0,93.71069182389937,Other
B074CWD7MS,"₹1,549","₹2,495",4.4,"15,137","AEACCLBAYRCRJLUMTQVS5JSOYYVA,AEBFS3LI626ABZMQMQQZAVCZMSEA,AEPNFXQVCUUGVV74K5KGJEIGCBMA,AE7YHD67JEECIX3IESFI44QL4HNQ,AFCCTAOXYH2XQNESLRQRH72G27ZQ,AGSVOGYYWRHJDZKU3MCFFYIPEVWQ,AGWVUW6YRWVQ3III5WXH7X4RE4DA,AHEH2QAVUEPNGB7EQJJWPYAOCAAQ","Joel Thomas,Joy Ghosh,Amazon Customer,Pıŋkɘsh Goʋɽ,Deepak Kanwaliya,AVINEESH,anoop tiwari,Kumud Prajapati","Worth a Purchase. Good Quality product,Strong, Mutiple channel, Durable.. Worth it ...,Robust, Durable (Phone Holder is added but not mentioned in Product details),Really Liked It!,Mast h,Nice amazing product,IS GOOD BUT NOT RECEIVED MOBILE HOLDER AND THIS PRODUCT BUY ONLY VIDEO REIVIEW,very handy and build quality is good at this price point",3,946.0,62.08416833667335,Other
B083342NKJ,₹349,₹399,4.4,"18,757","AGSGSRTEZBQY64WO2HKQTV7TWFSA,AEYD5HVYAJ23CR6PTWOOIKUOIDHA,AFRMNW6TDHDZBP2UHF2K3MEAEYUA,AHICHCW6EC3BNV2IDAEAJPBG4HZQ,AGWFKE7RNP6EVC4JFLFSL76EEVVQ,AGEOQQHGNELZNEUKJAJUA7NTPBLA,AFS3QBSOMCE2FAZFUYZ3NBFQDLMQ,AGJYG6ZWCWD74WNE6Y37XZ2VUSMA","Birendra ku Dash,Aditya Gupta,Abdulla A N,Deepak,Gowtham,Rakesh,Pawan Kumar,Prabhat Raj Pathak","Good product,using this product 8months It is done  I have not faced any problem so far, its build quality best,I really liked this one.,Very strong and support fast charging ,,Nice cable,Best data cable charging fast,Good job,Good but need some improvement",3,50.0,87.468671679198,Cables
B09C6HXFC1,₹970,"₹1,799",4.5,815,"AFNYIBWKJLJQKY4BGK77ZOTVMORA,AFCTNNMP2LZLY5466YJ5AY3JE5ZA,AG3XBWOAL65DJSBHJ7LQ2K54HJKQ,AF2ZFMLJS4UBCGZO4FMJTEPP6MHA,AFBZMRHC4GXUU7KNAK4OBKORDF6Q,AHSIQL276K7X2UP72QOOOWNVRSXA,AF3D6X5NQWOBOEVVH2Y37N55AKZQ,AFWOTSQXCQJLZ653Y7ACEZADKGYQ","Prasannavijayaraghavan G.,Preet Sikka,Theeban Raj,Nishikant,Gurpreet S.,Manoj,SP,Ashutosh","Good cable for car,Good substitute for orginal,Better Value for money Product,Way better than the original,Absolutely amazing.,Namm hi kafi hai,Very good,As the names say Durable cell it a durable cable ;-)",4,829.0,53.918843802112285,Cables
B00A0VCJPI,"₹1,469","₹2,499",4.2,"1,56,638","AG2X6MXVRQJD5VE7SYKNUNWVOQRQ,AHHZNQQE76XX2RN65TJO57ZXDDLQ,AGQ36NZXZMWU5W2JFXIK5GCM4MUA,AFBV4HQOSFPQYP63ELMOYRE32V6A,AH6SINCM4KQ3L4MEBRPK3MNHX6HA,AHSLNF7XKYX4LHL3JCCWY2KKNEAA,AGNSJO5LAO5FKSHPW3UDKZQLPONQ,AGSA37ZLXWHMSL74K3NMUHKGHWXA","Satya Sai Behera,Ashwanth G Kumar,Chetan,Shefali agarwal,Amazon Customer,ANIL G.,Rishi,Abishek kb","Okay to use,Worthy product ...!!!!👍,Single band. 2.4 ghz only,Difficult,Valued for money,So far all is good,Ok,it’s for 2.4Ghz",3,1030.0,58.78351340536214,Networking Devices
B00UGZWM2I,₹198,₹800,4.1,"9,344","AENFXWHBX7R7PZG2Q67PXLFGPHAQ,AESZWZDE27MOGUHBRLCLXLVPGAFQ,AG4UQP4EKBXW3ZFQFIEGYNY2UHWQ,AFOLBZKWUZVF4PQ33ISHI3DEFDUA,AFV6VAGYLU35VYPDF7TN4ZJOCTWA,AGA4MZI3ZKNPYUXSJ5OHUNI7EJPA,AFJCL4S4SSCDXKTSMZJQ7DWNWQBA,AFRUA3JDKXTUMZLL7DF6FA632JVQ","Ghazal,Vishwajeet,PREETI RAWAT,Karthi,Punjal s.,Anjali,Amazon Customer,jezz.ralte","Multipurpose and time-saving,Good notepad for travelers,Nice for the personal stuff,Super 👍,Most amazing product.,Too costly,Useful product,Good",3,602.0,24.75,Office Supplies
B00R1P3B4O,₹549,₹549,4.5,"4,875","AHVAI77H64YMRRMLITKJ5FPYALPQ,AGRSF3JCWR3L4M2GULFI4A4KCZKA,AGBRAMADVM5J4BNY7O4WWXMTYEBA,AHX5AFYII54YJY4XSBZU3HV2PN2A,AFTD5SG4EQFZYMU5MFGH4URN6PKQ,AEESPVBBOGON4LQB5OV3CCXNRKJQ,AG4FDTJABUWBNHOQZ6CDMPEV5VFA,AE637NV55PORSWGNKW547AAOV3VA","Nidhi,Nilanko Halder,Seenu,Daring Darcy,Vivek L.,Arpan Seth,Rajiv Ratta,MUKUL","The quality is surprisingly good! Happy with the purchase!!!,Perfect,Good,Good product! Original stuff with exp date 2024-05! Worth the money!,Could get used to it,Good,This product should not be played with fiddle with it or or open it roughly,Cool",4,0.0,100.0,Other
B0B3MWYCHQ,"₹2,999","₹9,999",4.2,"20,881","AHZNSNBVKQR4OGJAQHE4DCDA4YHA,AFBW6COTZXGHQMWVDUOSXVUCCIHQ,AFFRU7QVLXG4LNG6JKQKJ23KBA2A,AF5E74KNXXYBJVMG7HUYXNRNYY3A,AF4F4SKVD2UU7ZBJFZNNBK7ORIGA,AF3IVRFFILSUOKAXKRZBFBDRF7MQ,AF23WB7B2XKLYCA3KXEGKSBWYKOA,AHAJNAQDV3BHN5AYLY3LOWFJCS6A","Anirban,Abhi Khaire,Sachin,Tanisha bhoir,Jitendra vishwakarma,Archana,NILESH,Ajay","pocket friendly  smart watch for people who loves large  screen.,Value for money,Value for money product,My watch is not charging,Service,Good but it's not working now,GREAT PRODUCT....,Good product",3,7000.0,29.992999299929995,Wearables
B09DG9VNWB,"₹12,000","₹29,999",4.3,"4,744","AEPLUJYB5UT2XVP7A2NSNSCOCVLA,AEM3SCJOCJZZLGUXTB75C57SOVNQ,AEBRBDIZFIWDBOXITGLYRRSVZBTA,AF3GJDKWGWNKAWFJPJWX5GB75VHQ,AGCDYE3ROZ5D6RN2F6OGXL4I72RA,AEXQ4SRRBRCQ6ZBY2R2Y3FP7YCFA,AF6ME2VTJURUMEZJMGCC27XEYDPA,AGFPWV2V26QRXMWUSTSGYQRVLW4Q","Kshitij D.,gaurav agarwal,Brijnandan Singh,Div j,Sarath Ramesh,Yatindra A.,RINKAL PATEL,Kumaresan","LTE features (no other feature tested),Decent watch,Good not great,Great watch let down by battery life,Good fit, good apps,Wanted faster charging and better camera feed.,Mobile app Needs to be improved facing connectivity issues,Good",3,17999.0,40.00133337777926,Wearables
B09Y5MP7C4,"₹1,299","₹3,499",3.9,"12,452","AHLPMR4VVPOQ2YOHBFOZ55D7OUVQ,AFXQR65B2ONAPVNIFV6RMMJXATAQ,AHKIW5FEJBZVHD4MH7LBRDKXFJTA,AE4XZRBGX3OYZRK6X25BK6UW7KPA,AFA2RHFCGLLADX2Y6VEUWDGJZPNA,AFTW5AE7RXGZCZGGGE5CIVC6ODMQ,AH3VCCMOSINF7Z5TWDQPIJTI7LNA,AHQQ5CAMLDWCOYQLE46VT6DT7T6A","Achint,Anish,bhomick bhaskar,Sumit,Des Raj,Amazon Customer,Gursimranpallah,Amit Ahluwalia","BUDGET TWS,Does its job,Bhomick bhasker,Noise is nice,Des Raj,Noise -Good one,It's sound quality,It's worth it",2,2200.0,37.124892826521865,Other
B01DJJVFPC,₹269,₹315,4.5,"17,810","AFPSD5MVTPICFIXY5LKKTXSG7ZEA,AGJBM3XS26DC7YAEKR4MCLGOYVBA,AEZQUPHUINOCTERMXT3HOTVPLYGQ,AFSBPCLAH6PSYUW2CO7D3SLAZDXQ,AH6XCAUGFE76YB4KK6DPMXFQJFGA,AGFWFWJXJOOOZJGBRVWUFFHZVMVQ,AGKJJHQERUQMMSYWWDLXSY5VNH7A,AFXICPXB4TFIKV3SCE3LBN5W5QCQ","Aadi Injal,A RAMU,S.S.Sohi,Shaifali M.,Mahesh Kumar,Shubham shukla,Rahul,Vimal Raj","Longevity isn’t as long as I thought it would be,Good,Value for money,the expiry date and price covered by an external sticker. Can't make out anything,Good,Excellent customer service..,Good product,Good",4,46.0,85.39682539682539,Other
B07DFYJRQV,₹799,"₹1,499",4.1,"53,648","AFFSKDBFEU4DW4HMBLQ52IQXBHZA,AF6PMNNWP4CSP7MYSQ6UMLKNRUJQ,AEMSMWVWDYLWF3I3SCHPJPDTS5QQ,AGTCJJ32K5W5TMGLW3ZYSCOMHWVA,AGAO5NDUOORFZEJW3M27SHMV4IVA,AG4QLX5GRMA774DI4ZA6VHAWPXGA,AG4ZT4XUVYDG34W6WLOXQPYYMX2Q,AFG4YVV6ZDOXBWVY4WW7EZ7FABJQ","Amazon Customer,Viswas Reniguntla,Shreyas mc,KARAN,vishnu pareek,Sinu,Rohan Magar,Gokul","The price should be less than 500, not a very great product.,Good earphones,Average,Good earphone,Good for common men.,Nice headphone,Good looks but bass is not good as aspected..,Nice product",3,700.0,53.30220146764509,Other
B08L879JSN,"₹6,299","₹13,750",4.2,"2,014","AEKLUZARDMPMWERNPZFR6JD3BYBA,AFZLO4JX4Y2XDISGVAWMFE4GIZZA,AFGENKSKOZGTS6YYL5CYWKMV5MCA,AF4XQLEHSE3N5EXHAFITQTURTKUA,AEOHSSPCLSTWA4MAPWJJLJHSJDMQ,AFWL3FG6OEIIFL3TUJIB76DXYWXQ,AEUYQQW6ZI6DK2MJQTX2O7SNRENA,AHCEHLGVT3XPNMBLTOFSQRRZ3ZTQ","Mr. Nøbødy,Muzammil Khan,Nitish kumar,Yatharth Patil,Sathish,Alpesh Rathva,Suman R,virtual","Good monitor in this price range,My Best Buy in 2022,Average product for daily use. And some gaming.,its a good 1080 monitor,Nice product,price relaetd issue,Worth monitor this price,Decent monitor at this price with limitation",3,7451.0,45.81090909090909,Other
B08TDJNM3G,₹59,₹59,3.8,"5,958","AEJGZNKM5ZGH6UY2YX537NWNWYDQ,AGZGGK6OUCCSLXO34PHT72EFVDQA,AERTNA7V2HRIEPGANADEJFCY524Q,AHXQK2APPFORQPV6E43FW2W6DVVQ,AEMKH7NSGFU5YGYOC54RHG54WHXQ,AEITY7VD7DALKLQUEG6PFVIR4OIQ,AFUAADADBTTU3YB2FUJQC3C6IEBQ,AH7F7ZZ6T36PJAYQ5CEN62XKFPMA","Ravi Kumar s/o Devraj,anil-kumar,Soumith,Drew Arsenic,Jigar,Tamanna,H.N.GNANESH,Mihir Bhatti","Good,Product as described,Good for the price,Value for money,Good Product,Good product,Continue bright 3days no complaints,59 Rupees worth it",2,0.0,100.0,Other
B06XSK3XL6,₹571,₹999,4.3,"38,221","AFGPLYW6L6FYUGQDND7QGCRL2H2Q,AE3W6H2PP2KKMVEDIF4Z2RANULGA,AFERB3TDE3HAUIGGRZAO7LNF7SYA,AEC6SV7YUF3HQVEMSZOXIOJORZ2Q,AHHQF6UWD53IPS32OWDH7PX3LWWA,AEWG4B4DLLS74A5D5D2WYKSH4ZNA,AFYPBI2BVOVJGI2FTGVRG7IPNYTA,AFIOILAIZXRGBCG63U6QWKUJUL6Q","suraj,Bharanidhar,S.B.Vignesh,Srikanth GR,Hari,Shashi,Palanivel raja N,Pavan Singh","Good product,Value for money,Car charger,Good product,A good product- must have accessory for car,Good charger,Good,बहुत ही अच्छा चार्जर है",3,428.0,57.15715715715716,Phone/Mobile Accessories
B07YNTJ8ZM,₹549,₹999,3.9,"64,705","AFQ44B5ISCXUWKFHZL7HTRTYWZKA,AF3IECP2JCTQZRF55RNIHBLIVL2A,AFLK6ZRFGVUE3QE7RXQXHDOPPJUQ,AFPXGO2U6B5RAACITVCFJZEUNRKQ,AEQRAZQWNHPRGHNIFYNEIKPYOH6A,AE54CJI2T5ADE7M3QPQN7LC7ECTA,AGMN7AH7PCCN7UGWGCPJQLH2SWWA,AEAATGPU3JDB35QPGDBHURZCAH2A","Bhuwaneshwar kathlane,Jainit mukeshbhai Chauhan,Mahesh prajapati,Sonu Kumar,narender,Rajkumar jain,Bani panda,Dhiraj Tiwari","To good,Build material,Super,Good product,Budget bluetooth speaker which serves the purpose of low volume on a phone or laptop,best,It's OK to use in small room. But for Outdoor activities it will not meet our expectations.,Awesome product",2,450.0,54.95495495495496,Audio
B09KGV7WSV,"₹2,099","₹5,999",4.3,"17,129","AHJHHQWQ25VCIQHG5XMZN5MRZFYA,AFCFHU6B5RH4YN6DNTLUMY3CILHQ,AGLNHKFYTWDPKIAIQTE4UPB5I7ZQ,AEZKRUEG7M7P4JGJEVHMWZ3MGFPA,AHXWYJUQTCQRTQG3XYEAAYI3EURA,AHYAIOJLTBNK23OEWQ2BELX3PVXA,AHPP7A2M3LU7BWBZVIWXBNIVAPNA,AG6FKYZZA7HPN54KNFM5EIKJNDSQ","Ishwar Singh Sankhla,sai k.,Prathmesh Acharekar,T-y,Jasmin Gosrani,Pankaj,Mahesh,Muzafar","Really Satisfied with purchase.,DO NOT BELIEVE ANSWERS FOR QUESTIONS SAYING IT WORKS ON iPad Pro 10.5 inch (A1701),Does all the necessary stuff,No Double Tap Gesture,5 star product at this price,Very good product,Automatically off's itself,Value for money pen",3,3900.0,34.989164860810135,Phone/Mobile Accessories
B08DPLCM6T,"₹13,490","₹21,990",4.3,"11,976","AHBNKB74LGTYUOKPAJBSKNFV45CA,AFIECTV45ADX5YPTE2VU6ORRHTGQ,AFDUJI7KG7VMZF4JGJHV4DBCA4OA,AEUWKSX5ZL7DWOOYVDOWJKBHOVXA,AHEJW5MYVFOQBEXD6BIUBB3PJBPQ,AEM2Y22BKLFYL5BK7SC56Q75ODOQ,AHWDVB4OO4S3YS5RYQZIDBNV6BUQ,AFCEDQXVCB4LUUBWXRJS6KRU62FQ","NIRMAL.N,Manoj kumar,SOMNATH DAS,Harsha,Pradhut Roy,MAHENDRA NATH DAS,Naveen Kumar,Gopi Sahu","Sound quality,Very nice,Value for money,Good,Good for its price.,Good item,Budget friendly,Good",3,8500.0,61.34606639381537,TVs
B07KR5P3YD,₹448,₹699,3.9,"17,348","AE35OI7LDTOKU32IFQ3GQX5AOKFQ,AHT5CRFFKABTHYW4ECKZTQFY46NA,AEXIV3RFI5NFISHPIOIRBFCEMKUQ,AE4ADCFGK4BPHVK426KLAGJIECTA,AHGC4ISYSAWYL3CB4IONRS7WO2AQ,AHQQYHFW6CVRWYWGJ53LNZKKCSZQ,AEJOCAMBYG2VFPAYA67LRSSAMDBQ,AHESOERCB5FRKL7BYJ6QQHK4BMJQ","lucky,SALMAN S,Rahul Singh,INSOLARE ENERGY PVT Ld,Sandeep Kumar Sahu,Amazon Customer,Sudhanshu,Jp","light weight okay in this price range,Value for money,Good,EASY TO USE,Value for money,this is no soft touch keyboard,Good product in this price range,Budget friendly",2,251.0,64.09155937052932,Mouse
B08FB2LNSZ,"₹1,499","₹2,999",3.7,"87,798","AGZCXPBXKXIEQTY4AH7KM6OPQW3Q,AF7IPRBRDY6D4F7XVZW4QZZRI3KQ,AHGJXZZRXZB2T477ZTVMMKDT3LGA,AHXW4TW4TIIXXSXFZXBR2MWZLVQA,AGUQ57PHU2MEG2BIYVXDH5WDDDZA,AH2MCCISNTRUSC5FU5VOYCGL575A,AH4IURQX3DSNH4KLG3MFMVNAR64A,AFNBAIT26TZ4OJCNYY37T6SWDS3A","Amazonnig,Anurag,p_v_,Anil Kumar,Ignatius Nayan D'Rozario,Amazon Customer,Maulik Aryan,basraj","Good headphones, the sound is good, not sure about comfort,Just Ok,Budget Entry Level Banger Headset,Good quality product,Good multipoint connectivity. Falls off the ear,Good quality, but battery draining,ANC very bad,Bluetooth not working after 4 month",2,1500.0,49.983327775925304,Other
B01IBRHE3E,₹299,₹499,4.2,"24,432","AFAVJJJRDJZCFKPZ4ACGTYBLRJBQ,AEZBJMTSQQ7IGWYTZDUQ24KXSFWA,AFGZQNTKB7GCYDFGCOV2MF2VBSXA,AHM3MJSP4J3IJUZE6ENH3352KDVQ,AFDE6CEFGDYLXV7SSVU7NCEZKXKA,AHNR5FBWUV4A5XSJXNBBK26US5XQ,AH2YX7BOKWSCK4CRS3U5IOHLPPQQ,AGNBRGWKNVYUJI43BQVDG7UPV6PQ","Siddharth suman,Soumayan Chakraborty,Papori,Agasthya,Jiten Sinku,Aleena,Ram Surat,Uday Kumar","Very fine product..,Good,Worth the money,Does what it says,Value for money product but brush is not good.,Easy to use,Good product,Worthable",3,200.0,59.919839679358724,Other
B01N6LU1VF,₹579,"₹1,400",4.3,"1,89,104","AF7IXQKBUL6NEIQG4R53LMJJUGXQ,AFVFGVFOC6WUUL7VZ3ZSBDAFMPOA,AHIQYP5QKXYWXGJC5Z6YGIZVQTKA,AGCXB54PNFRXYGF7NLH66BHO6S7A,AGJTDMCUUNZJRJKAQGZNFBSZUAMQ,AEBHV4MEUEGYYUNRYNMTNAEZFRBQ,AEFIFJIV3YDBR7WKSDYX4JEQSCDA,AGJ7FX6Z4B7QEM6DG2BT26XG6XWA","Neeraj Vishwakarma,UD,M.Sathish kumar,Karthik,Kunjasha.v.kadu,Govind N.,Yogesh Tayde,Amima khatun","It takes Forever - to transfer anything. Maybe I - misunderstood ""Ultra"" or somebody missed ""Ultra-Slow"" in the model tag line.,Comprehensive Review of Product, Company & Seller,Desigh and usage,Good purchase not best,Sd card,Good Quality product,Pendrive Quality to Aacchi H Par , Storage 64 Gb Ki jagah 61 Gb Hi Milta H 3Gb Kam Milta H,Good",3,821.0,41.35714285714286,Storage
B07XLML2YS,"₹2,499","₹3,299",4.2,"93,112","AF3HHR5VANS5ZX2IATPSOZDFEP7A,AEGDY32LMHDQODUG3Y452L2DSSOQ,AFYM2YCDE6SZB4OHEG4NX7OWJI5Q,AGIT26W6BSDLN6OOXKXIYASNSPXA,AG6WNF3AQBACEWDTRW6UM2MALT2A,AHKRFXJ6RBOTGHZ2QFSLO5BBRHIA,AHMRH27KXXRCKPVINMYZCJRLSGZA,AGOU3P3LXMXSZTQLWKGNGS3Y5TYQ","Maxrock89,Ayush negi,Rakesh,prasanth,Suraj,Sudhi/Deeps,Vigneshraja,KONDOJU HEMANTHA CHARY","VFM indoor use (living room/bedrrom) use and clear view upto 120sqft rooms,Best camera in its segment but the app lags,Best,You have to pay to avail all services,All good,I was sent a used product...,Good Product,Upto mark",3,800.0,75.75022734161867,Other
B086WMSCN3,"₹1,199","₹5,999",3.9,"47,521","AEU6MYQDUVKLBHRXLKVRUIEWLX6Q,AHCIZVWUXAKRCE6KVLLMUKEL2QMQ,AGBUNLUGN3BK6UA3QIFOWGZVTLFQ,AH6WR7DW4S5LL5XV6UALLTX7XH6A,AFC5A2WLRTDARIZXW6FH3SDWVD5A,AHW76O7CH2OHYK2TO5A5BKXJMRTQ,AFEXISDUUT35W2QRLZHXXRXSAG6Q,AGB7Z7NMD5362JFEZKZOJJJHD5OA","Narasimha Rao,Anitha Dalwai,Sachin Ghadge,Udaya Shankar G,Abedh Babu,Neha,Hiro,KAPIL JINDAL","Good,Bluetooth range coverage is poor,Good product,Below average product model,Good product.,Complaint,To be honest these ear buds are actually decent and legit,Nice Product",2,4800.0,19.986664444074012,Other
B003B00484,₹399,₹499,4.3,"27,201","AG2ICOYPSOV5SGBKFEYHGKCNK7PA,AGJ3OQ4X262D3MAQZ3CLCRVR5R3Q,AGWXCIC2IWWGNN5I4QTFMPSLSTHQ,AHG33NYBIPVHA7BABNXDT4NDZBMQ,AFWPPZRH2WVNMVTLFNXMAJCTTVFA,AG7Y7ZU2S5Y2H7UJX6AFGQSRB7ZQ,AHAVRPA7Z3PKTTWVBVUISCKI7RYQ,AHKW7DR7CHI2WL772IRNUK3SOAUA","T N Sivaji,Akku,V,Meet,MOHAMMED,Niranjan koyri,Tamil selvan,Puneet S.","Works Good,Perfect replacement cell for trimmer,Wow,As they said in ad worth it,A good product,Fit for phillips trimmer.,Good,Good Product",3,100.0,79.95991983967936,Other
B085194JFL,₹279,₹499,3.7,"10,962","AEO5FHWNOSFBT554DKQAG4ICBGFQ,AGIQ5Y7Q4MKZ542KKVFZLAIZV6GQ,AFD53TWXXCPJAYQJ7REZPW34AKKQ,AHBMHE56M3IAD7Z4KXUKREAZX3WQ,AFR4YULNFZZC5DJOWH2KNFAOM6BQ,AEP5UMK4KDMGZGBHBLZDB2R37OMA,AHLKQWAPXICPCSCIPIF6C6FOENOQ,AHTBS46SCEBGWK4SUH3FOQEORR3Q","aditya d.,Paranthaman,ashik rahman c,Rajas c.,Madan Tejaswi,Sumit,chaitanya srikrishna,subeh sharma","Good product ; Average Finishing,Save it purpose well without any issue. I am satisfied,No issues,NO NEED TO PUT AUX CABLE FOR CONNECTING AUDIO FROM SECONDARY MONITOR,Good product,Not so Bad,Good,Worked will for only 3-4 months.",2,220.0,55.91182364729459,Cables
B09F6S8BT6,"₹13,490","₹22,900",4.3,"16,299","AHEVO4Q5NM4YXMG2HDDXC5XMBGRQ,AFZPH7ZAWX5VDY3HOBNYRDGIDBVA,AFURD6VVHRG4HZ36KXGXYUTVUDLA,AHJF5BZJNDLXJXSW74ZPLHGO7GUA,AFUS52CHEA75E2YGQ6SYGP3PKBGA,AGS3YC22FW2PCSH3I7ODDXETZ6BA,AGGI2H2AGOIX6IBDJRWULYUP5DPQ,AG4TU4LCQXF2XTLMMGMFTNWL3OOA","Rahman Ali,MARIYA DASS,Md Aftab,roshan s.,Mohan,Devendu Sawant,Shek hussain,Prathap Pathaneni","Good,Sound is very low another brand comparing in better,Service provider not meet my home refuse, tv i am not using bad service,Good product,Ok super,Floor stand does not come with it ...,Good,A budget friendly TV with a clumsy UI and Remote",3,9410.0,58.90829694323144,TVs
B003L62T7W,₹279,₹375,4.3,"31,534","AE6DY6YWTSSE3XNHDXZDGQM2JL2Q,AES3UPSNCD37JZLHZ3OIILRLLLCA,AESL7YEFFKTIZRBEDUCMD56K6VQA,AHEV734TKPP6CEJPWIMMHA65SL2A,AGBLMQ2TLWRDFQ32LGRIVVPYOQVQ,AHKUSAJGBXVQQSDC4RCKHF6PFODQ,AEPEJSIYSFPXKOXPS2QHZ7P5VCIA,AEU44FW4XJBDB33N4LYZMVLOUYOA","Uday Joglekar,Simi Singh,Hi,chirag bansal,Swarnavo Dutta,H Rt khuma,Adarsh,Dixit","Handy Mouse,Good quality mouse,Good one.,Good,Good cheap reliable,Gud quality mouse,Very comfortable,Quality + Less Price Makes it Best to buy.",3,96.0,74.4,Other
B09P18XVW6,"₹2,499","₹4,999",3.9,"7,571","AFO7LXSMPQDD7JG6I5QARG5I4N6A,AFWFOKIGSV22T2HT62VTTV6LUN3Q,AHF32Q6YAAQ7QNHEROCDCCWFUOPQ,AECXZYGASHXD24MRMRWAS4JAHENA,AF2GDZL7TSXL4TIODN72IU3MWGMQ,AFDOG7VEXVBQAS7QZY7S4S37GKAQ,AFZUN3PXHMWKAANEXOL22647UYBQ,AGQQ5YMVO337YAMQZFRARULONQ5Q","Kindle Customer,Arun Kalkunte,Amit Kumar,Dhanush,Shiva sai,Moumita Bhanja,Nagaraj S H,Maneesh Mathew","Best for this price,Nice starter smartwatch,Work,Very light weight watch,Smart watch,Good looking,Super,Good",2,2500.0,49.98999799959992,Wearables
B00LZLPYHW,₹137,₹160,4.4,"6,537","AGQBRQKHB6V2GKNP5NQCBG3TZFPQ,AGXXROFSXQ7UYFJ4SM2KRSY5GNUQ,AE4OJDGKLBRC3SKJV2S3AHVXBWBA,AEUDSXTROWKKBDOIXDIPXVUR5GAA,AGB2VOIFUR7OVK5G6TMSPV52XHFA,AF6LSVYUDV7WMLIBPHXHBDSVFDTA,AHPXWAFSPVEID3MIG3SFU4XFOSLA,AF7QEOPISA5J33YVAQWX2EGDEPUQ","Hamsavarthini,Samir Shukla,Shahbaz,Shar,Akshay,armaan,Alok Kumar Dixit,Alok pandey","Good,Boss of premium note books 🏆,Didn't expected single binding!,Good purchase,Good Quality but paper could be thicker...,Worth the Money!,Good quality,Nice products",3,23.0,85.625,Office Supplies
B09NHVCHS9,₹59,₹199,4.0,"9,377","AHIKJUDTVJ4T6DV6IUGFYZ5LXMPA,AE55KTFVNXYFD5FPYWP2OUPEYNPQ,AEBWA5I4QFCA3P3OBEPMELBGN4GQ,AHMGAC6QM62UXNEOCZIHLHSXPP2Q,AFHROSCGIXUPV3FYQ7H5QOD46Q7Q,AEAMIR3CMSA32IDEINSJKHRNANTA,AF355FTXYAKFH5NYPRTE7SL3WO3Q,AG5DWPD54QGSLWJ6QUFERLPNAX4Q","$@|\|TO$|-|,Sethu madhav,Akash Thakur,Burger Planet,Justice ⚖️,indrajyoti d.,Aditya Kumar,E.C.GEORGE","Worked on iPhone 7 and didn’t work on XR,Good one,Dull Physical Looks,Just Buy it,Go for it,About the product,Get charging cable at the price,Working well.",3,140.0,29.64824120603015,Cables
B00NNQMYNE,₹299,₹499,4.5,"21,010","AGK3NNXG44TLWHYTJ2OAY4JMD3VA,AGKSHSI672DMOJKNVYC33PPKNISQ,AGTC43ZF53CWD5YIEPDMGMDP22TQ,AGHCWVVH53TQGWLKJOGWOYCLLU6A,AGWXGUALH6VESAYTZGWBZBUDTWFA,AESGEGKMDBH4NA6TM7NJILHKW3WQ,AEMDPZ5BX65L4P5KNIF3MZTZ6PEQ,AGRH5LRSEB7REHEO2KY6RSZYERTA","Souradip,Narendran D,Mandar Barve,P Nagar,Amazon Customer,Ravindra Chauhan,Karishma binraj,Jithin","Super,Excellent structural rigidity,Durable and classy,Sturdy. Good quality,Good quality and durable.,Best,Good,Tough built quality and smooth movement of zip",4,200.0,59.919839679358724,Other
B0B217Z5VK,"₹1,799","₹3,999",3.9,"3,517","AH2QFGBZYKJDYPAKHEEXUKLZDYTQ,AG2RP4LU7VSU67OTVBAC6LSKI3PQ,AGC6NVLEXXVXAOMXP46RL2622EBA,AEQHT4NCWZ6DDFMOV3QW3W7N5HDQ,AGPYAZNUEWYCAGM4A4WWQNUXD25Q,AEEH35CH4JAERU44DZYQVKQVXGHA,AF67OFMRED2DAQUDHR32ZPSIZEAQ,AHFCRBRVKYQJW75E4DQHUOXK7IVA","RAHUL GOUD,Nitesh,Lokesh K V,KESHAV Kohli,Ozair Ahmad GLS,vishal mandal,Vicky Kumar,Mohamed A.","Clear voice,Nice,Good and recomended,It was a nice product,It's good.,Vishal Mandal,Value of Money,Bass quality was good",2,2200.0,44.98624656164041,Other
B07B88KQZ8,"₹1,999","₹2,999",4.3,"63,899","AEWM6BXJQ76ZA3JH3TEG3ORMEDCA,AFWCCY4OETWIYGV47TLKUZG3NAZA,AG2SGIEE46YOK5J5WFS52KHY4PYA,AHTWRETINVEPSRPIOUQTVART3IBQ,AFRSGOLOZ6Q45OOHXXHDH25XYHCQ,AEO6PDZZEPLEYE6MLIQMEEOEVJEQ,AELS6LXTPB4C5JNSXZVLDQDAZ42Q,AFV3TYH4ZUHBEHG57TJOZ6XAQICA","Murali am,Mithul R.,Ritesh kumar,Debia Pipa,sarang,gopal,MSK Purushothaman,Divyanshu Saraph","Don't believe the other reviews,Awesome sound and clarity for like name JBL,Bass is ❤️,Quality,Excellent sound quality and bass,, gud battery life Best speaker for single room use,Sound is not protect,Good audio.,Not a significant upgrade from JBL Go",3,1000.0,66.65555185061687,Audio
B01M4GGIVU,₹199,₹699,4.2,"12,153","AGVUE2NFN2MQEOQ4PR525B2ZI5PQ,AFO4M4BQ2WS7A3LPKJY45B5C7DYQ,AG6CREU25N6P2H7RCHNIU6GGJ5BA,AHFITGJEF76CXALJZLYP6OIC4EOA,AG54MN24SX3EMMON4AMBUNL74K3Q,AF3GETWWBGMLASY2KKNNBS2VO6DQ,AHEIPXMFMVWHNPLGUXUIV5XNP2SA,AFWQRBBVJWYTYUFQHUJE63S6VXJQ","Yashpreet Singh,Abiram,Aakaash Ramchandani,Amit katoch,Avijit Basak,Anirban B.,Dass,Gopalakrishnan","Cheap product and same is the performance but does the job,Good,No Box!!!,Good,Value for money,A very good quality cable with rubust built, and it does the work.,Value money,Good product.",3,500.0,28.469241773962807,Cables
B07Z3K96FR,₹399,"₹1,499",4.1,"5,730","AFUWVHBC2SCTJ7VEAWEIEYW5V4KA,AFYBMZW3AZJKJJTALIIXD7ZGEHKA,AFUFHMKHZZMFJX554XNEXXTJXWEQ,AHXXQS4GRLX7EK5BE6LFT6OKTWZA,AGUPGGFPP73O6INTDQ4RCOGZA2HQ,AGNZRKED7ZOR5CWLAVUPIYAYAOGA,AET5GWBU6F666XIYM4PJ6EY5WCKQ,AHQ4S2IRIVYCHMRQ2JX27C6KY3IQ","Dakshvir Singh,Palash Kapuri,Abhijit Gupta,Buyer,Anmol Saxena,Irfaan,Hon,dr sanjay kore (some kore)","Gud for the price, but adhesion quality is not very good,Nothing unique……,Attracts too much finger impressions,Perfect Fit (Almost),Easy to install,They provide tissues and wipes,Work well and easy to install,Gud product in budget",3,1100.0,26.617745163442297,Other
B0756CLQWL,"₹1,699","₹3,999",4.2,"25,488","AFR7NDA6QYOPSCNJIDXRDRHJIYXA,AHHCHJMZSYKSIE6TTZMRNSBE7WTQ,AFSPQFXDIKOSTXLMOGOBF4WR4SPA,AGHBP6BZR4HZMOMFJ7O2A22EAEWA,AHIPJJAVOME7HM7PQCZAEOJRLLSQ,AFYOIOJCLIUTH3O47WX3UURCJZ2A,AFHSGENEII3KZX2B4PUT7PN4E2AQ,AHAMQ4BF5OY7VBA7DZTCFBRK7QPA","Shafeer Pn,Sudhanshu S.,S U P E R M A N,Radhika V.,Amazon User.,rushikesh,Amazon Customer,Hrutik","Value for money,Very good.,Overall good but very fragile! KEYS STOPPED WORKING AFTER 3 MONTHS,Got what I wanted,good,Recommended I used wired version,slightly overpriced but worth it.,Product",3,2300.0,42.48562140535134,Other
